,url,title,authorname,avg_rating,num_rat,num_rev,total_pages,ori_year,places,series,awards,genre3
0,https://www.goodreads.com//book/show/13496.A_Game_of_Thrones,A Game of Thrones,George R.R. Martin,4.44,"2,084,416","55,502",835,2005,The Lands of Ice and Fire,1,"Nebula Award Nominee for Best Novel (1997), Locus Award for Best Fantasy Novel (1997), World Fantasy Award Nominee for Best Novel (1997), Premio Ignotus for Novela extranjera (2003)","['Fantasy', 'Fiction', 'Fantasy']"
1,https://www.goodreads.com//book/show/30.J_R_R_Tolkien_4_Book_Boxed_Set,J.R.R. Tolkien 4-Book Boxed Set: The Hobbit and The Lord of the Rings,J.R.R. Tolkien,4.60,"114,607","1,837",1728,2012,Middle-earth,1,,"['Fantasy', 'Fiction', 'Classics']"
2,https://www.goodreads.com//book/show/186074.The_Name_of_the_Wind,The Name of the Wind,Patrick Rothfuss,4.52,"759,974","43,986",662,2007,,1,"Locus Award Nominee for Best First Novel and Best Fantasy Novel (2008), Compton Crook Award Nominee (2008), Grand Prix de l'Imaginaire Nominee for Roman étranger and Traduction (2010), ALA Alex Award (2008), The Quill Award for Science Fiction/Fantasy/Horror (2007) ...more","['Fantasy', 'Fiction', 'Fantasy']"
3,https://www.goodreads.com//book/show/7235533-the-way-of-kings,The Way of Kings,Brandon Sanderson,4.61,"334,282","22,153",1007,2010,Roshar,1,"Locus Award Nominee for Best Fantasy Novel (2011), David Gemmell Legend Award for Best Fantasy Novel (2011), Whitney Award for Best Novel (2010), Goodreads Choice Award Nominee for Fantasy and for Favorite Book and for Goodreads Author (2010)","['Fantasy', 'Fiction', 'Fantasy']"
4,https://www.goodreads.com//book/show/11127.The_Chronicles_of_Narnia,The Chronicles of Narnia,C.S. Lewis,4.26,"545,434","10,668",767,2002,"London, England (United Kingdom)",1,,"['Fantasy', 'Classics', 'Fiction']"
5,https://www.goodreads.com//book/show/228665.The_Eye_of_the_World,The Eye of the World,Robert Jordan,4.17,"412,040","13,670",814,1990,Emond's Field,1,Locus Award Nominee for Best Fantasy Book (1991),"['Fantasy', 'Fiction', 'Fantasy']"
6,https://www.goodreads.com//book/show/68428.Mistborn,Mistborn: The Final Empire,Brandon Sanderson,4.44,"437,261","30,642",541,2006,Luthadel,1,"Tähtifantasia Award Nominee (2018), Prix Elbakin.net for Meilleur roman fantasy traduit (2010)","['Fantasy', 'Fiction', 'Fantasy']"
7,https://www.goodreads.com//book/show/18116.His_Dark_Materials,His Dark Materials,Philip Pullman,4.25,"150,053","5,321",1088,2003,"Oxford, England",1,Literaturpreis der Jury der jungen Leser for Kinderbuch (2002),"['Fantasy', 'Young Adult', 'Fiction']"
8,https://www.goodreads.com//book/show/113436.Eragon,Eragon,Christopher Paolini,3.91,"1,497,065","22,885",503,2005,Alagaësia,1,"Book Sense Book of the Year Award for Children's Literature (2004), Books I Loved Best Yearly (BILBY) Awards for Older Readers (2007), South Carolina Book Award for Young Adult Book (2006), Grand Canyon Reader Award for Teen Book (2006), Nene Award (2006) ...more","['Fantasy', 'Young Adult', 'Fiction']"
9,https://www.goodreads.com//book/show/77197.Assassin_s_Apprentice,Assassin's Apprentice,Robin Hobb,4.15,"248,939","10,743",435,1996,Buckkeep,1,"Locus Award Nominee for Fantasy (1996), British Fantasy Award Nominee for Best Novel (1997), Compton Crook Award (1996)) Nominee (1996)","['Fantasy', 'Fiction', 'Fantasy']"
10,https://www.goodreads.com//book/show/29588376-the-lies-of-locke-lamora,The Lies of Locke Lamora,Scott Lynch,4.26,"240,838","15,655",752,2006,Camorr,1,"Locus Award Nominee for Best Fantasy Novel and Best First Novel (2007), World Fantasy Award Nominee for Best Novel (2007), Compton Crook Award Nominee (2007), Grand Prix de l'Imaginaire Nominee for Roman étranger (2008), Tähtifantasia Award Nominee (2008) ...more","['Fantasy', 'Fiction', 'Adventure']"
11,https://www.goodreads.com//book/show/43615.The_Gunslinger,The Gunslinger,Stephen King,3.94,"533,755","19,708",231,2003,,1,,"['Fantasy', 'Fiction', 'Horror']"
12,https://www.goodreads.com//book/show/43889.Wizard_s_First_Rule,Wizard's First Rule,Terry Goodkind,4.11,"234,886","6,712",836,2003,,1,Locus Award Nominee for Best first novel (1995),"['Fantasy', 'Fiction', 'Fantasy']"
13,https://www.goodreads.com//book/show/944073.The_Blade_Itself,The Blade Itself,Joe Abercrombie,4.17,"177,113","9,615",515,2007,,1,"Locus Award Nominee for Best First Novel (2007), Compton Crook Award Nominee (2008), Tähtifantasia Award Nominee (2010)","['Fantasy', 'Fiction', 'Fantasy']"
14,https://www.goodreads.com//book/show/7332.The_Silmarillion,The Silmarillion,J.R.R. Tolkien,3.93,"231,275","8,564",386,2004,Middle-earth,1,"Locus Award for Best Fantasy Novel (1978), Ditmar Award for Best International Long Fiction (1978), Gandalf Award (1978)","['Fantasy', 'Fiction', 'Classics']"
15,https://www.goodreads.com//book/show/55399.Gardens_of_the_Moon,Gardens of the Moon,Steven Erikson,3.88,"97,060","5,921",657,2005,,1,"Locus Award Nominee for Best First Novel (2000), World Fantasy Award Nominee for Best Novel (2000), Prix Aurora Award Nominee for Best of the Decade (2017), Le Blanc Award for Melhor Romance Estrangeiro de Fantasia, Ficção Científica ou Terror Publicado em Língua Portuguesa (2018)","['Fantasy', 'Fiction', 'Fantasy']"
16,https://www.goodreads.com//book/show/21787.The_Princess_Bride,The Princess Bride,William Goldman,4.25,"805,836","21,063",456,2003,,0,,"['Fantasy', 'Fiction', 'Classics']"
17,https://www.goodreads.com//book/show/44660.The_Belgariad_Boxed_Set,The Belgariad Boxed Set: Pawn of Prophecy / Queen of Sorcery / Magician's Gambit / Castle of Wizardry / Enchanters' End Game,David Eddings,4.28,"14,671",262,1635,1986,,1,,"['Fantasy', 'Fantasy', 'Epic Fantasy']"
18,https://www.goodreads.com//book/show/13642.A_Wizard_of_Earthsea,A Wizard of Earthsea,Ursula K. Le Guin,3.99,"256,116","10,403",183,2004,Earthsea Realm,1,"Lewis Carroll Shelf Award (1979), Boston Globe-Horn Book Award for Fiction (1969), Złota Sepulka for Książka autora zagranicznego (1984), Margaret A. Edwards Award (2004)","['Fantasy', 'Fiction', 'Young Adult']"
19,https://www.goodreads.com//book/show/13812.Magician,Magician: Apprentice,Raymond E. Feist,4.14,"88,238","1,944",485,1994,,1,,"['Fantasy', 'Fiction', 'Fantasy']"
20,https://www.goodreads.com//book/show/40605251-the-mists-of-avalon,The Mists of Avalon,Marion Zimmer Bradley,4.11,"197,577","6,885",1009,2001,Camelot,1,Locus Award for Best Fantasy Novel (1984),"['Fantasy', 'Fiction', 'Historical']"
21,https://www.goodreads.com//book/show/518848.Sabriel,Sabriel,Garth Nix,4.14,"194,316","7,938",491,1996,Old Kingdom,1,"برنده جایزه آریلیس, Ditmar Award Nominee for Short Fiction (1996), Aurealis Award for Fantasy Novel and Young Adult Novel (1995), Lincoln Award Nominee (2005)","['Fantasy', 'Young Adult', 'Fiction']"
22,https://www.goodreads.com//book/show/6122735-the-night-angel-trilogy,The Night Angel Trilogy,Brent Weeks,4.42,"24,129",623,1392,2009,,1,,"['Fantasy', 'Fiction', 'Fantasy']"
23,https://www.goodreads.com//book/show/9579634-prince-of-thorns,Prince of Thorns,Mark Lawrence,3.85,"100,327","6,924",373,2011,,1,"Grand Prix de l'Imaginaire Nominee (2013), David Gemmell Morningstar Award Nominee for Best Fantasy Newcomer (2012), Goodreads Choice Award Nominee for Fantasy (2011)","['Fantasy', 'Fiction', 'Fantasy']"
24,https://www.goodreads.com//book/show/61942.The_Dragonriders_of_Pern,The Dragonriders of Pern,Anne McCaffrey,4.25,"27,706",574,864,1988,Pern,1,,"['Fantasy', 'Science Fiction', 'Fiction']"
25,https://www.goodreads.com//book/show/3428935-the-warded-man,The Warded Man,Peter V. Brett,4.23,"113,877","5,480",416,2009,,1,"Locus Award Nominee for Best First Novel (2009), LovelyBooks Leserpreis for Bester Klappentext (2009)","['Fantasy', 'Fiction', 'Fantasy']"
26,https://www.goodreads.com//book/show/3236307-graceling,Graceling,Kristin Cashore,4.07,"405,227","23,000",471,2008,,1,"Locus Award Nominee for Best First Novel (2009), Mythopoeic Fantasy Award for Children's Literature (2009), William C. Morris YA Debut Award Nominee (2009), Rhode Island Teen Book Award (2011), Milwaukee County Teen Book Award Nominee (2010) ...more","['Fantasy', 'Young Adult', 'Romance']"
27,https://www.goodreads.com//book/show/12067.Good_Omens,"Good Omens: The Nice and Accurate Prophecies of Agnes Nutter, Witch",Terry Pratchett,4.24,"577,688","29,005",491,2006,"London, England (United Kingdom)",0,"Locus Award Nominee for Best Fantasy Novel (1991), World Fantasy Award Nominee for Best Novel (1991)","['Fantasy', 'Fiction', 'Humor']"
28,https://www.goodreads.com//book/show/34497.The_Color_of_Magic,The Color of Magic,Terry Pratchett,3.98,"331,309","10,150",228,2005,Discworld,1,Margaret A. Edwards Award (2011),"['Fantasy', 'Fiction', 'Humor']"
29,https://www.goodreads.com//book/show/153008.Kushiel_s_Dart,Kushiel's Dart,Jacqueline Carey,3.99,"77,262","4,187",901,2003,Terre D'Ange,1,"Locus Award for Best First Novel (2002), Gaylactic Spectrum Award Nominee for Best Novel (2002), Romantic Times Reviewers' Choice Award (RT Award) for Best Fantasy Novel (2001)","['Fantasy', 'Romance', 'Fiction']"
30,https://www.goodreads.com//book/show/17332218-words-of-radiance,Words of Radiance,Brandon Sanderson,4.74,"228,503","13,714",1087,2014,Roshar,1,"Locus Award Nominee for Best Fantasy Novel (2015), David Gemmell Legend Award for Best Fantasy Novel (2015), David Gemmell Ravenheart Award for Best Fantasy Cover Art (2015), Goodreads Choice Award Nominee for Fantasy (2014), Reddit r/fantasy Stabby Award for Best Novel (2014)","['Fantasy', 'Fiction', 'Fantasy']"
31,https://www.goodreads.com//book/show/7996.Redwall,Redwall,Brian Jacques,4.10,"109,655","3,999",352,2006,,1,West Australian Young Readers' Book Award (WAYRBA) for Older Readers (1990),"['Fantasy', 'Fiction', 'Young Adult']"
32,https://www.goodreads.com//book/show/68380.Dragonlance_Chronicles,Dragonlance Chronicles,Margaret Weis,4.23,"19,692",525,1030,1988,,1,,"['Fantasy', 'Dungeons and Dragons', 'Dragonlance']"
33,https://www.goodreads.com//book/show/29396.Furies_of_Calderon,Furies of Calderon,Jim Butcher,4.11,"100,889","4,217",504,2005,Alera,1,,"['Fantasy', 'Fiction', 'Fantasy']"
34,https://www.goodreads.com//book/show/13569581-blood-song,Blood Song,Anthony Ryan,4.39,"77,676","4,122",591,2012,,1,,"['Fantasy', 'Fantasy', 'Epic Fantasy']"
35,https://www.goodreads.com//book/show/68418.The_Dark_Elf_Trilogy_Collector_s_Edition,The Dark Elf Trilogy Collector's Edition,R.A. Salvatore,4.34,"26,180",509,808,2000,,1,,"['Fantasy', 'Dungeons and Dragons', 'Forgotten Realms']"
36,https://www.goodreads.com//book/show/1170158.The_Earthsea_Trilogy,The Earthsea Trilogy,Ursula K. Le Guin,4.27,"18,751",404,478,1979,,1,,"['Fantasy', 'Fiction', 'Young Adult']"
37,https://www.goodreads.com//book/show/91981.The_Dragonbone_Chair,The Dragonbone Chair,Tad Williams,3.94,"66,606","2,053",672,2005,,1,,"['Fantasy', 'Fiction', 'Fantasy']"
38,https://www.goodreads.com//book/show/7165300-the-black-prism,The Black Prism,Brent Weeks,4.21,"107,426","5,175",629,2010,,1,"David Gemmell Legend Award Nominee for Best Fantasy Novel (2011), Endeavour Award Nominee (2011), Goodreads Choice Award Nominee for Fantasy (2010)","['Fantasy', 'Fiction', 'Fantasy']"
39,https://www.goodreads.com//book/show/68488.Fool_s_Errand,Fool's Errand,Robin Hobb,4.29,"80,654","2,129",661,2002,Buckkeep,1,,"['Fantasy', 'Fiction', 'Fantasy']"
40,https://www.goodreads.com//book/show/478894.The_Sword_of_Shannara_Trilogy,The Sword of Shannara Trilogy,Terry Brooks,3.95,"21,975",458,1200,2002,,1,,"['Fantasy', 'Fiction', 'Fantasy']"
41,https://www.goodreads.com//book/show/27712.The_Neverending_Story,The Neverending Story,Michael Ende,4.16,"175,894","6,996",396,1997,Fantastica,0,"Buxtehuder Bulle (1979), Zilveren Griffel (1983), Preis der Leseratten des ZDF (1980)","['Fantasy', 'Classics', 'Fiction']"
42,https://www.goodreads.com//book/show/10790290-theft-of-swords,Theft of Swords,Michael J. Sullivan,4.18,"60,303","3,931",649,2011,,1,Drying Ink's Best Epic Fantasy (2011),"['Fantasy', 'Fiction', 'Fantasy']"
43,https://www.goodreads.com//book/show/13831.Alanna,Alanna: The First Adventure,Tamora Pierce,4.23,"122,979","5,191",274,2005,Tortall,1,"Preis der Leseratten des ZDF, NSK Neustadt Prize for Children's Literature Nominee (2013), Margaret A. Edwards Award (2013)","['Fantasy', 'Young Adult', 'Fiction']"
44,https://www.goodreads.com//book/show/5367.The_Great_Book_of_Amber,The Great Book of Amber,Roger Zelazny,4.31,"24,398",926,1258,1999,,1,,"['Fantasy', 'Fiction', 'Science Fiction']"
45,https://www.goodreads.com//book/show/104089.Tigana,Tigana,Guy Gavriel Kay,4.06,"46,332","2,680",676,1999,,0,"Locus Award Nominee for Best Fantasy Novel (1991), World Fantasy Award Nominee for Best Novel (1991), Mythopoeic Fantasy Award Nominee (1991), Prix Aurora Award for Best Long Form Work in English (1991)","['Fantasy', 'Fiction', 'Fantasy']"
46,https://www.goodreads.com//book/show/43545.The_Once_and_Future_King,The Once and Future King,T.H. White,4.04,"105,589","4,146",639,1987,United Kingdom,1,Tähtifantasia Award Nominee (2019),"['Fantasy', 'Classics', 'Fiction']"
47,https://www.goodreads.com//book/show/1268479.Warbreaker,Warbreaker,Brandon Sanderson,4.26,"129,997","9,709",688,2009,,1,David Gemmell Legend Award Nominee for Best Fantasy Novel (2010),"['Fantasy', 'Fiction', 'Fantasy']"
48,https://www.goodreads.com//book/show/45100.Ship_of_Magic,Ship of Magic,Robin Hobb,4.13,"67,720","2,925",880,1999,,1,"Endeavour Award Nominee (1999), Le Blanc Award Nominee for Melhor Romance Estrangeiro de Fantasia, Ficção Científica ou Terror Publicado em Língua Portuguesa (2018)","['Fantasy', 'Fiction', 'Fantasy']"
49,https://www.goodreads.com//book/show/28876.His_Majesty_s_Dragon,His Majesty's Dragon,Naomi Novik,4.03,"84,802","6,672",356,2006,United Kingdom,1,"Hugo Award Nominee for Best Novel (2007), Locus Award for Best First Novel (2007), Compton Crook Award (2007)","['Fantasy', 'Fantasy', 'Dragons']"
50,https://www.goodreads.com//book/show/179033.The_Chronicles_of_Thomas_Covenant_the_Unbeliever,"The Chronicles of Thomas Covenant, the Unbeliever",Stephen R. Donaldson,3.80,"14,524",345,1160,1993,,1,"Locus Award Nominee for Best Fantasy Novel (1978) and Best All-Time Fantasy Novel (1987) and Best All-Time Fantasy Novel before 1990 (1998), World Fantasy Award Nominee for Best Novel (1978), Balrog Award Nominee for Best Novel (1979), British Fantasy Award for Best Novel (August Derlith Fantasy Award) (1979)","['Fantasy', 'Fiction', 'Fantasy']"
51,https://www.goodreads.com//book/show/6294.Howl_s_Moving_Castle,Howl’s Moving Castle,Diana Wynne Jones,4.25,"236,859","16,671",329,2001,Ingary,1,"Phoenix Award (Children's Literature Association) (2006), Boston Globe-Horn Book Award (1987)","['Fantasy', 'Young Adult', 'Fiction']"
52,https://www.goodreads.com//book/show/463063.The_Chronicles_of_Prydain,The Chronicles of Prydain,Lloyd Alexander,4.41,"6,737",257,1104,2007,,1,,"['Fantasy', 'Young Adult', 'Fiction']"
53,https://www.goodreads.com//book/show/140671.The_Black_Company,The Black Company,Glen Cook,3.91,"45,729","1,969",319,1992,,1,,"['Fantasy', 'Fiction', 'Fantasy']"
54,https://www.goodreads.com//book/show/210329.The_Dark_Is_Rising,The Dark Is Rising,Susan Cooper,4.05,"52,168","2,469",272,2007,,1,"Newbery Medal Nominee (1974), Mythopoeic Fantasy Award Nominee (1974), Boston Globe-Horn Book Award for Fiction (1973), Margaret A. Edwards Award (2012)","['Fantasy', 'Young Adult', 'Fiction']"
55,https://www.goodreads.com//book/show/47953.The_Black_Jewels_Trilogy,"The Black Jewels Trilogy: Daughter of the Blood, Heir to the Shadows, Queen of the Darkness",Anne Bishop,4.38,"13,016",635,1204,2003,,1,,"['Fantasy', 'Romance', 'Fiction']"
56,https://www.goodreads.com//book/show/407813.The_Blue_Sword,The Blue Sword,Robin McKinley,4.18,"60,732","2,947",256,1987,,1,"Newbery Medal Nominee (1983), Dorothy Canfield Fisher Children's Book Award Nominee (1984)","['Fantasy', 'Young Adult', 'Fiction']"
57,https://www.goodreads.com//book/show/597790.The_Children_of_H_rin,The Children of Húrin,J.R.R. Tolkien,3.96,"71,406","3,432",313,2007,Middle-earth,1,Tähtifantasia Award Nominee (2008),"['Fantasy', 'Fiction', 'Classics']"
58,https://www.goodreads.com//book/show/28249.The_Magicians_Guild,The Magicians' Guild,Trudi Canavan,3.94,"76,852","2,758",467,2004,Kyralia,1,,"['Fantasy', 'Young Adult', 'Fantasy']"
59,https://www.goodreads.com//book/show/82192.The_Crystal_Cave,The Crystal Cave,Mary Stewart,4.13,"42,534","1,756",494,2003,United Kingdom,1,Mythopoeic Fantasy Award (1971),"['Fantasy', 'Historical', 'Historical Fiction']"
60,https://www.goodreads.com//book/show/334123.The_Amulet_of_Samarkand,The Amulet of Samarkand,Jonathan Stroud,4.00,"121,424","5,185",462,2003,"London, England (United Kingdom)",1,"Mythopoeic Fantasy Award for Children's Literature (2006), Deutscher Jugendliteraturpreis Nominee for Jugendbuch (2005)","['Fantasy', 'Young Adult', 'Fiction']"
61,https://www.goodreads.com//book/show/1381.The_Odyssey,The Odyssey,Homer,3.78,"893,253","13,107",541,2006,Ithaca (Greece),0,,"['Classics', 'Fiction', 'Poetry']"
62,https://www.goodreads.com//book/show/13928.Daughter_of_the_Forest,Daughter of the Forest,Juliet Marillier,4.23,"59,811","4,323",554,2002,,1,"Locus Award Nominee for Best First Novel (2001), ALA Alex Award (2001), Aurealis Award Nominee for Fantasy Novel (1999)","['Fantasy', 'Romance', 'Fiction']"
63,https://www.goodreads.com//book/show/1148721.The_Fionavar_Tapestry,The Fionavar Tapestry,Guy Gavriel Kay,4.21,"6,899",245,792,1995,,1,Mythopoeic Fantasy Award Nominee (1987),"['Fantasy', 'Fiction', 'Cultural']"
64,https://www.goodreads.com//book/show/10611.The_Eyes_of_the_Dragon,The Eyes of the Dragon,Stephen King,3.93,"110,404","4,767",427,1993,,0,,"['Fantasy', 'Fiction', 'Horror']"
65,https://www.goodreads.com//book/show/30036.Elric_of_Melnibon_,Elric of Melniboné,Michael Moorcock,3.89,"23,446","1,024",181,1987,Melniboné,1,,"['Fantasy', 'Fiction', 'Heroic Fantasy']"
66,https://www.goodreads.com//book/show/7896527-throne-of-glass,Throne of Glass,Sarah J. Maas,4.19,"670,794","47,767",406,2012,"Rifthold, Adarlan",1,"Lincoln Award Nominee (2015), North Carolina Young Adult Book Award for High School (2015), Goodreads Choice Award Nominee for Young Adult Fantasy & Science Fiction (2012)","['Young Adult', 'Fiction', 'Fantasy']"
67,https://www.goodreads.com//book/show/60400.The_Ruins_of_Gorlan,The Ruins of Gorlan,John Flanagan,4.21,"131,294","7,865",249,2006,Araluen,1,Rebecca Caudill Young Readers' Book Award Nominee (2008),"['Fantasy', 'Young Adult', 'Adventure']"
68,https://www.goodreads.com//book/show/77366.The_Hero_and_the_Crown,The Hero and the Crown,Robin McKinley,4.21,"50,423","2,355",240,1987,,1,"Newbery Medal (1985), Mythopoeic Fantasy Award Nominee (1985), Dorothy Canfield Fisher Children's Book Award Nominee (1986)","['Fantasy', 'Young Adult', 'Fiction']"
69,https://www.goodreads.com//book/show/62485.The_Icewind_Dale_Trilogy_Collector_s_Edition,The Icewind Dale Trilogy Collector's Edition,R.A. Salvatore,4.30,"15,385",251,1040,2001,,1,,"['Fantasy', 'Dungeons and Dragons', 'Forgotten Realms']"
70,https://www.goodreads.com//book/show/96281.The_Deed_of_Paksenarrion,The Deed of Paksenarrion,Elizabeth Moon,4.30,"12,405",675,1040,1992,,1,,"['Fantasy', 'Fiction', 'Fantasy']"
71,https://www.goodreads.com//book/show/40603587-the-last-wish,The Last Wish,Andrzej Sapkowski,4.12,"218,379","14,652",360,2008,,1,"Premio Ignotus for Mejor antología (2003), Tähtifantasia Award (2011)","['Fantasy', 'Fiction', 'Short Stories']"
72,https://www.goodreads.com//book/show/62291.A_Storm_of_Swords,A Storm of Swords,George R.R. Martin,4.53,"686,008","22,517",1177,2003,Westeros,1,"Hugo Award Nominee for Best Novel (2001), Nebula Award Nominee for Best Novel (2001), Locus Award for Best Fantasy Novel (2001), Geffen Award for Best Translated Fantasy Book (2002), Premio Ignotus (2006) ...more","['Fantasy', 'Fiction', 'Fantasy']"
73,https://www.goodreads.com//book/show/68427.Elantris,Elantris,Brandon Sanderson,4.17,"190,999","11,729",638,2006,,1,,"['Fantasy', 'Fiction', 'Fantasy']"
74,https://www.goodreads.com//book/show/12891107-king-of-thorns,King of Thorns,Mark Lawrence,4.20,"57,156","2,731",449,2012,,1,"David Gemmell Legend Award Nominee for Best Fantasy Novel (2013), Goodreads Choice Award Nominee for Fantasy (2012)","['Fantasy', 'Fiction', 'Fantasy']"
75,https://www.goodreads.com//book/show/61886.The_Curse_of_Chalion,The Curse of Chalion,Lois McMaster Bujold,4.10,"37,578","2,377",490,2003,,1,"Hugo Award Nominee for Best Novel (2002), Locus Award Nominee for Best Fantasy Novel (2002), World Fantasy Award Nominee for Best Novel (2002), Mythopoeic Fantasy Award for Adult Literature (2002)","['Fantasy', 'Fiction', 'Fantasy']"
76,https://www.goodreads.com//book/show/76658.On_a_Pale_Horse,On a Pale Horse,Piers Anthony,4.14,"36,640","1,579",325,1986,,1,,"['Fantasy', 'Fiction', 'Science Fiction']"
77,https://www.goodreads.com//book/show/589979.Daughter_of_the_Empire,Daughter of the Empire,Raymond E. Feist,4.28,"33,476",879,421,1988,Kelewan,1,,"['Fantasy', 'Fiction', 'Fantasy']"
78,https://www.goodreads.com//book/show/29127.The_Last_Unicorn,The Last Unicorn,Peter S. Beagle,4.14,"101,409","4,595",294,2008,,1,Национални фантастични награди for Любим превод за 2015 г. – първо място (2016),"['Fantasy', 'Fiction', 'Classics']"
79,https://www.goodreads.com//book/show/100915.The_Lion_the_Witch_and_the_Wardrobe,"The Lion, the Witch and the Wardrobe",C.S. Lewis,4.22,"2,239,548","23,500",206,2005,"London, England (United Kingdom)",1,"Lewis Carroll Shelf Award (1962), The Keith Barker Millennium Children's Book Awards 'Children's Book of the Century', Retro Hugo Award Nominee for Best Novel (2001)","['Fantasy', 'Classics', 'Fiction']"
80,https://www.goodreads.com//book/show/77160.Across_the_Nightingale_Floor,Across the Nightingale Floor,Lian Hearn,4.06,"36,736","2,182",305,2002,,1,"Wirral Paperback of the Year (2004), Peter Pan Award, Deutscher Jugendliteraturpreis for Preis der Jugendjury (2004), Lincoln Award Nominee (2007), Carnegie Medal Nominee (2002) ...more","['Fantasy', 'Fiction', 'Historical']"
81,https://www.goodreads.com//book/show/4345290-the-crown-conspiracy,The Crown Conspiracy,Michael J. Sullivan,4.19,"19,756","1,054",296,2008,,1,,"['Fantasy', 'Fiction', 'Fantasy']"
82,https://www.goodreads.com//book/show/28481.Dragon_Wing,Dragon Wing,Margaret Weis,3.96,"26,265",639,430,1990,,1,,"['Fantasy', 'Fiction', 'Fantasy']"
83,https://www.goodreads.com//book/show/2315892.Best_Served_Cold,Best Served Cold,Joe Abercrombie,4.16,"70,289","3,055",534,2009,Styria (Austria),1,"David Gemmell Legend Award Nominee for Best Fantasy Novel (2010), British Fantasy Award Nominee for Best Novel (2010), The Kitschies Nominee for Red Tentacle (Novel) (2009), David Gemmell Ravenheart Award for Best Fantasy Cover Art (2010)","['Fantasy', 'Fiction', 'Fantasy']"
84,https://www.goodreads.com//book/show/13836.Wild_Magic,Wild Magic,Tamora Pierce,4.26,"78,200","2,180",362,2005,Tortall,1,,"['Fantasy', 'Young Adult', 'Fiction']"
85,https://www.goodreads.com//book/show/261604.Rhapsody,Rhapsody: Child of Blood,Elizabeth Haydon,3.96,"18,935",588,656,2000,,1,,"['Fantasy', 'Fiction', 'Fantasy']"
86,https://www.goodreads.com//book/show/147843.Green_Rider,Green Rider,Kristen Britain,4.03,"36,935","1,808",471,2000,,1,,"['Fantasy', 'Young Adult', 'Fiction']"
87,https://www.goodreads.com//book/show/616678.The_Diamond_Throne,The Diamond Throne,David Eddings,3.96,"32,797",565,435,1990,,1,,"['Fantasy', 'Fiction', 'Fantasy']"
88,https://www.goodreads.com//book/show/13986.Arrows_of_the_Queen,Arrows of the Queen,Mercedes Lackey,4.09,"38,433","1,098",320,1987,"Sensholding, Valdemar",1,Michigan Library Association Thumbs Up! Award Nominee (1988),"['Fantasy', 'Young Adult', 'Fiction']"
89,https://www.goodreads.com//book/show/2767793-the-hero-of-ages,The Hero of Ages,Brandon Sanderson,4.48,"286,675","17,318",572,2008,,1,David Gemmell Legend Award Nominee for Best Fantasy Novel (2009),"['Fantasy', 'Fiction', 'Fantasy']"
90,https://www.goodreads.com//book/show/19821.Riddle_Master,Riddle-Master,Patricia A. McKillip,4.22,"10,316",557,578,1999,,1,,"['Fantasy', 'Fiction', 'Young Adult']"
91,https://www.goodreads.com//book/show/28759.Magic_s_Pawn,Magic's Pawn,Mercedes Lackey,4.21,"24,423",859,349,1989,Valdemar,1,Lambda Literary Award Nominee for Gay Men's Science Fiction/Fantasy (1990),"['Fantasy', 'LGBT', 'Fiction']"
92,https://www.goodreads.com//book/show/133454.Jhereg,Jhereg,Steven Brust,4.13,"13,980",568,307,2005,,1,,"['Fantasy', 'Fiction', 'Fantasy']"
93,https://www.goodreads.com//book/show/3227063-the-way-of-shadows,The Way of Shadows,Brent Weeks,4.13,"154,483","5,209",645,2008,Cenaria,1,"David Gemmell Legend Award Nominee (2009), Compton Crook Award Nominee (2009)","['Fantasy', 'Fiction', 'Fantasy']"
94,https://www.goodreads.com//book/show/104101.The_Lions_of_Al_Rassan,The Lions of Al-Rassan,Guy Gavriel Kay,4.29,"19,677","1,380",528,2005,,0,,"['Fantasy', 'Historical', 'Historical Fiction']"
95,https://www.goodreads.com//book/show/185253.The_Magic_of_Recluce,The Magic of Recluce,L.E. Modesitt Jr.,3.85,"22,995",682,501,1992,,1,,"['Fantasy', 'Fiction', 'Fantasy']"
96,https://www.goodreads.com//book/show/39058.The_Gormenghast_Novels,The Gormenghast Novels,Mervyn Peake,4.00,"8,513",636,1173,1995,Gormenghast,1,,"['Fantasy', 'Fiction', 'Classics']"
97,https://www.goodreads.com//book/show/185289.Dragon_Prince,Dragon Prince,Melanie Rawn,3.95,"15,362",461,576,2005,,1,"Locus Award Nominee for Best First Novel (1989), Compton Crook Award Nominee (1989)","['Fantasy', 'Fantasy', 'Dragons']"
