,url,title,authorname,avg_rating,num_rat,num_rev,total_pages,ori_year,places,series,awards,genre3
307,https://www.goodreads.com//book/show/213647.The_Warrior_Heir,The Warrior Heir,Cinda Williams Chima,3.94,"49,026","3,274",426,2007,"Trinity, Ohio (United States)",1,South Carolina Book Award Nominee for Young Adult Book Award (2009),"['Fantasy', 'Young Adult', 'Fantasy']"
308,https://www.goodreads.com//book/show/14686.The_King_of_Elfland_s_Daughter,The King of Elfland's Daughter,Lord Dunsany,3.83,"6,258",598,240,1999,,0,Tähtifantasia Award Nominee (2008),"['Fantasy', 'Classics', 'Fiction']"
309,https://www.goodreads.com//book/show/3342764-the-magician-s-apprentice,The Magician's Apprentice,Trudi Canavan,3.96,"22,687",707,593,2009,Kyralia,1,Aurealis Award for Fantasy Novel (2009),"['Fantasy', 'Fantasy', 'Magic']"
310,https://www.goodreads.com//book/show/565335.Acacia,Acacia: The War with the Mein,David Anthony Durham,3.57,"8,559",548,576,2007,,1,,"['Fantasy', 'Fiction', 'Fantasy']"
311,https://www.goodreads.com//book/show/587582.Queen_of_Sorcery,Queen of Sorcery,David Eddings,4.11,"69,550","1,162",326,1982,,1,,"['Fantasy', 'Fiction', 'Young Adult']"
312,https://www.goodreads.com//book/show/13658.The_Other_Wind,The Other Wind,Ursula K. Le Guin,4.14,"20,460","1,147",211,2003,Earthsea Realm,1,"Nebula Award Nominee for Best Novel (2002), World Fantasy Award for Best Novel (2002), Mythopoeic Fantasy Award Nominee for Adult Literature (2002)","['Fantasy', 'Fiction', 'Young Adult']"
313,https://www.goodreads.com//book/show/44687.Enchanters_End_Game,Enchanters' End Game,David Eddings,4.16,"89,992",964,384,1984,,1,,"['Fantasy', 'Fiction', 'Fantasy']"
314,https://www.goodreads.com//book/show/19288321-fool-s-assassin,Fool's Assassin,Robin Hobb,4.38,"43,815","2,885",688,2014,,1,"Tähtifantasia Award Nominee (2019), David Gemmell Ravenheart Award Nominee for Best Fantasy Cover Art (2015), Goodreads Choice Award Nominee for Fantasy (2014)","['Fantasy', 'Fiction', 'Fantasy']"
315,https://www.goodreads.com//book/show/9268487-the-daylight-war,The Daylight War,Peter V. Brett,4.21,"54,858","2,329",639,2013,,1,"David Gemmell Legend Award Nominee for Best Fantasy Novel (2014), Goodreads Choice Award Nominee for Fantasy (2013)","['Fantasy', 'Fantasy', 'Epic Fantasy']"
316,https://www.goodreads.com//book/show/29587324-deep-world-fire,Deep World Fire,C.M. Meridian,4.18,51,9,,2016,,1,,"['Fantasy', 'Fantasy', 'Epic Fantasy']"
317,https://www.goodreads.com//book/show/28194.Inkheart,Inkheart,Cornelia Funke,3.89,"388,688","12,392",563,2005,Italy,1,"Locus Award Nominee for Best Young Adult Book (2004), Mythopoeic Fantasy Award Nominee for Children's Literature (2004), Zilveren Griffel (2006), Grand Prix de l'Imaginaire Nominee for Roman jeunesse (2004), Nene Award (2009) ...more","['Fantasy', 'Young Adult', 'Fiction']"
318,https://www.goodreads.com//book/show/92755.The_Riddle_Master_of_Hed,The Riddle-Master of Hed,Patricia A. McKillip,4.00,"11,740",505,240,1980,,1,,"['Fantasy', 'Fiction', 'Young Adult']"
319,https://www.goodreads.com//book/show/20882143-blood-borne,"Blood Borne (Cathedral Chronicles, #1)",Elizabeth Wixley,4.43,138,43,233,2014,,0,,"['Fantasy', 'Science Fiction', 'Horror']"
320,https://www.goodreads.com//book/show/722667.The_Dream_Quest_of_Unknown_Kadath,The Dream-Quest of Unknown Kadath,H.P. Lovecraft,3.99,"6,082",378,144,1976,,1,Retro Hugo Award Nominee for Best Novella (2019),"['Horror', 'Fantasy', 'Fiction']"
321,https://www.goodreads.com//book/show/189783.The_Elfstones_of_Shannara,The Elfstones of Shannara,Terry Brooks,3.95,"69,995","1,683",23,2003,,1,,"['Fantasy', 'Fiction', 'Fantasy']"
322,https://www.goodreads.com//book/show/176277.The_Time_of_the_Dark,The Time of the Dark,Barbara Hambly,3.98,"5,094",213,263,2000,Darwath,1,,"['Fantasy', 'Fiction', 'Science Fiction Fantasy']"
323,https://www.goodreads.com//book/show/1166599.The_Gathering_Storm,The Gathering Storm,Robert Jordan,4.36,"133,699","3,547",783,2009,,1,"David Gemmell Legend Award Nominee for Best Fantasy Novel (2010), Goodreads Choice Award Nominee for Fantasy (2009)","['Fantasy', 'Fiction', 'Fantasy']"
324,https://www.goodreads.com//book/show/18666047-half-a-king,Half a King,Joe Abercrombie,3.95,"55,463","5,173",336,2014,,1,"Locus Award for Best Young Adult Book (2015), David Gemmell Legend Award Nominee for Best Fantasy Novel (2015), Premi Ictineu for Millor novel·la traduïda (2016), David Gemmell Ravenheart Award Nominee for Best Fantasy Cover Art (2015)","['Fantasy', 'Young Adult', 'Fiction']"
325,https://www.goodreads.com//book/show/45109.Golden_Fool,Golden Fool,Robin Hobb,4.30,"70,773","1,398",709,2003,Buckkeep,1,,"['Fantasy', 'Fiction', 'Fantasy']"
326,https://www.goodreads.com//book/show/27774758-an-ember-in-the-ashes,An Ember in the Ashes,Sabaa Tahir,4.26,"206,391","25,274",446,2016,,1,"Pennsylvania Young Readers' Choice Award Nominee for Young Adults (2017), Rhode Island Teen Book Award Nominee (2017), Evergreen Teen Book Award Nominee (2018), Milwaukee County Teen Book Award Nominee (2016), Dioraphte Jongerenliteratuurprijs Nominee for Vertaald boek (2016) ...more","['Fantasy', 'Young Adult', 'Romance']"
327,https://www.goodreads.com//book/show/5094.The_Drawing_of_the_Three,The Drawing of the Three,Stephen King,4.21,"226,990","8,100",463,2003,,1,,"['Fantasy', 'Fiction', 'Horror']"
328,https://www.goodreads.com//book/show/22852698-the-liar-s-key,The Liar's Key,Mark Lawrence,4.25,"17,020","1,014",480,2015,,1,"David Gemmell Legend Award for Best Fantasy Novel (2016), David Gemmell Ravenheart Award for Best Fantasy Cover Art (2016), Goodreads Choice Award Nominee for Fantasy (2015)","['Fantasy', 'Fiction', 'Fantasy']"
329,https://www.goodreads.com//book/show/234225.Dune,Dune,Frank Herbert,4.23,"843,549","28,080",604,2006,Arrakis,1,"Hugo Award for Best Novel (1966), Nebula Award for Best Novel (1965), Seiun Award 星雲賞 for Best Foreign Novel (1974)","['Science Fiction', 'Fiction', 'Fantasy']"
330,https://www.goodreads.com//book/show/568099.Waylander,Waylander,David Gemmell,4.28,"18,240",366,310,1995,,1,,"['Fantasy', 'Fiction', 'Fantasy']"
331,https://www.goodreads.com//book/show/14497.Neverwhere,Neverwhere,Neil Gaiman,4.16,"448,292","23,605",370,2003,"London, England (United Kingdom)",1,"Mythopoeic Fantasy Award Nominee for Adult Literature (1998), Prix Julia Verlanger (1999)","['Fantasy', 'Fiction', 'Fantasy']"
332,https://www.goodreads.com//book/show/32628.The_Great_and_Secret_Show,The Great and Secret Show,Clive Barker,4.06,"28,845",727,658,1999,"Omaha, Nebraska, 1969 (United States)",1,,"['Horror', 'Fantasy', 'Fiction']"
333,https://www.goodreads.com//book/show/7347.The_Book_of_Lost_Tales_Part_One,"The Book of Lost Tales, Part One",J.R.R. Tolkien,3.84,"13,170",365,367,1992,,1,Mythopoeic Fantasy Award Nominee (1985),"['Fantasy', 'Fiction', 'Classics']"
334,https://www.goodreads.com//book/show/18002053-the-return-of-the-dragons,The Return of the Dragons,Kenneth Kappelmann,4.54,54,3,429,2013,,0,,['Fantasy']
335,https://www.goodreads.com//book/show/15761926-in-the-devil-s-own-words,In The Devil's Own Words,Elizabeth Wixley,4.39,165,34,,2012,,0,,"['Horror', 'Suspense', 'Fantasy']"
336,https://www.goodreads.com//book/show/20923990-the-lone-apprentice,The Lone Apprentice,I.K. Spencer,4.08,39,12,,2014,,0,,[]
337,https://www.goodreads.com//book/show/28735.By_the_Sword,By the Sword,Mercedes Lackey,4.25,"19,865",313,492,1991,,1,,"['Fantasy', 'Fiction', 'Science Fiction Fantasy']"
338,https://www.goodreads.com//book/show/9245759-the-lament-of-the-stone,The Lament of the Stone,Dora Machado,4.03,118,8,602,2011,,1,,['Fantasy']
339,https://www.goodreads.com//book/show/5096.Wizard_and_Glass,Wizard and Glass,Stephen King,4.23,"174,803","6,269",845,2003,,1,,"['Fantasy', 'Fiction', 'Horror']"
340,https://www.goodreads.com//book/show/13922.Wolfskin,Wolfskin,Juliet Marillier,4.02,"6,651",298,544,2004,,1,,"['Fantasy', 'Historical', 'Historical Fiction']"
341,https://www.goodreads.com//book/show/13497.A_Feast_for_Crows,A Feast for Crows,George R.R. Martin,4.14,"647,818","22,076",1061,2011,,1,"Hugo Award Nominee for Best Novel (2006), Locus Award Nominee for Best Fantasy Novel (2006)","['Fantasy', 'Fiction', 'Fantasy']"
342,https://www.goodreads.com//book/show/15549.Armageddon_s_Children,Armageddon's Children,Terry Brooks,4.11,"15,577",754,371,2006,,1,,"['Fantasy', 'Fiction', 'Science Fiction Fantasy']"
343,https://www.goodreads.com//book/show/104086.The_Summer_Tree,The Summer Tree,Guy Gavriel Kay,3.98,"21,781","1,403",383,2001,"Toronto, Ontario (Canada)",1,,"['Fantasy', 'Fiction', 'Fantasy']"
344,https://www.goodreads.com//book/show/15744546-parish-secrets,Parish Secrets,Megan White,3.67,96,19,185,2012,,1,,"['Fantasy', 'Young Adult', 'Gothic']"
345,https://www.goodreads.com//book/show/33913854-the-false-prophet,The False Prophet,Harry James Fox,4.51,59,28,343,2017,,1,,"['Fantasy', 'Christian', 'Christian Fiction']"
346,https://www.goodreads.com//book/show/6585201-changes,Changes,Jim Butcher,4.49,"102,228","4,240",438,2010,"Chicago, Illinois (United States)",1,Goodreads Choice Award Nominee for Paranormal Fantasy (2010),"['Fantasy', 'Fantasy', 'Urban Fantasy']"
347,https://www.goodreads.com//book/show/60211.The_Shadow_of_the_Torturer,The Shadow of the Torturer,Gene Wolfe,3.80,"22,141","1,405",262,1984,Urth,1,"Nebula Award Nominee for Best Novel (1980), Locus Award Nominee for Best Fantasy Novel (1981), World Fantasy Award for Best Novel (1981), British Science Fiction Association Award for Best Novel (1981), John W. Campbell Memorial Award Nominee (1981) ...more","['Fantasy', 'Science Fiction', 'Fiction']"
348,https://www.goodreads.com//book/show/400924.Chronicles_of_the_Black_Company,Chronicles of the Black Company,Glen Cook,4.22,"22,841",712,704,2007,,1,,"['Fantasy', 'Fiction', 'Fantasy']"
349,https://www.goodreads.com//book/show/39063.Titus_Groan,Titus Groan,Mervyn Peake,3.91,"16,440","1,472",396,1991,Gormenghast,1,,"['Fantasy', 'Fiction', 'Classics']"
350,https://www.goodreads.com//book/show/28733.Take_a_Thief,Take a Thief,Mercedes Lackey,4.13,"12,984",215,435,2002,,1,,"['Fantasy', 'Fiction', 'Science Fiction Fantasy']"
351,https://www.goodreads.com//book/show/45110.Shaman_s_Crossing,Shaman's Crossing,Robin Hobb,3.47,"20,845",902,591,2006,,1,Grand Prix de l'Imaginaire for Roman étranger (2007),"['Fantasy', 'Fiction', 'Fantasy']"
352,https://www.goodreads.com//book/show/18392.The_Lost_Years_of_Merlin,The Lost Years of Merlin,T.A. Barron,3.98,"18,467",830,304,2002,,1,,"['Fantasy', 'Young Adult', 'Fiction']"
353,https://www.goodreads.com//book/show/13616278-the-red-knight,The Red Knight,Miles Cameron,4.11,"15,417","1,123",650,2012,,1,David Gemmell Morningstar Award Nominee for Best Fantasy Newcomer (2013),"['Fantasy', 'Fantasy', 'Epic Fantasy']"
354,https://www.goodreads.com//book/show/31305863-the-shadow-crucible,The Shadow Crucible,T.M. Lakomy,4.05,97,31,368,2017,,0,,"['Fantasy', 'Horror', 'Fantasy']"
355,https://www.goodreads.com//book/show/399373.The_Swords_Trilogy,The Swords Trilogy,Michael Moorcock,4.07,"2,505",82,403,1988,,1,Mythopoeic Fantasy Award Nominee (1972),"['Fantasy', 'Fiction', 'Heroic Fantasy']"
356,https://www.goodreads.com//book/show/40869.Suldrun_s_Garden,Suldrun's Garden,Jack Vance,3.93,"5,094",318,448,2002,,1,"Nebula Award Nominee for Best Novel (1984), Locus Award Nominee for Best Fantasy Novel (1984), World Fantasy Award Nominee for Best Novel (1984), British Fantasy Award Nominee for Best Novel (1985)","['Fantasy', 'Fiction', 'Fantasy']"
357,https://www.goodreads.com//book/show/4978.Wolves_of_the_Calla,Wolves of the Calla,Stephen King,4.16,"164,902","4,422",931,2006,,1,Bram Stoker Award Nominee for Best Novel (2003),"['Fantasy', 'Fiction', 'Horror']"
358,https://www.goodreads.com//book/show/92121.Nine_Princes_in_Amber,Nine Princes in Amber,Roger Zelazny,4.05,"55,186","1,992",175,1986,Amber,1,Mythopoeic Fantasy Award Nominee (1971),"['Fantasy', 'Fiction', 'Science Fiction']"
359,https://www.goodreads.com//book/show/450692.Myrren_s_Gift,Myrren's Gift,Fiona McIntosh,3.85,"4,676",208,528,2006,,1,,"['Fantasy', 'Fiction', 'Science Fiction Fantasy']"
360,https://www.goodreads.com//book/show/24213.Alice_s_Adventures_in_Wonderland_Through_the_Looking_Glass,Alice's Adventures in Wonderland / Through the Looking-Glass,Lewis Carroll,4.06,"479,239","11,210",239,2000,United Kingdom,1,,"['Classics', 'Fantasy', 'Fiction']"
361,https://www.goodreads.com//book/show/10754265-the-written,The Written,Ben Galley,3.71,"1,642",224,418,2011,,1,,"['Fantasy', 'Fantasy', 'Epic Fantasy']"
362,https://www.goodreads.com//book/show/613991.The_King_Beyond_the_Gate,The King Beyond the Gate,David Gemmell,4.13,"13,159",251,415,1986,The Drenai Empire,1,,"['Fantasy', 'Fiction', 'Fantasy']"
363,https://www.goodreads.com//book/show/25744891-dragon-eaters,Dragon Eaters,Janet E. Morris,4.63,117,19,436,2015,,1,,"['Fantasy', 'Fantasy', 'Dragons']"
364,https://www.goodreads.com//book/show/13662.The_Tombs_of_Atuan,The Tombs of Atuan,Ursula K. Le Guin,4.08,"96,814","3,475",180,2001,Earthsea Realm,1,"Newbery Medal Nominee (1972), National Book Award Nominee for Children's Books (1972), Mythopoeic Fantasy Award Nominee (1972), Margaret A. Edwards Award (2004)","['Fantasy', 'Fiction', 'Young Adult']"
365,https://www.goodreads.com//book/show/15560.Ilse_Witch,Ilse Witch,Terry Brooks,3.98,"17,569",278,456,2001,,1,,"['Fantasy', 'Fiction', 'Fantasy']"
366,https://www.goodreads.com//book/show/201341.Mossflower,Mossflower,Brian Jacques,4.10,"65,230",908,373,1998,,1,West Australian Young Readers' Book Award (WAYRBA) for Older Readers (1991),"['Fantasy', 'Fiction', 'Young Adult']"
367,https://www.goodreads.com//book/show/2767052-the-hunger-games,The Hunger Games,Suzanne Collins,4.32,"6,684,696","175,490",374,2008,"District 12, Panem",1,"Locus Award Nominee for Best Young Adult Book (2009), Georgia Peach Book Award (2009), Buxtehuder Bulle (2009), Golden Duck Award for Young Adult (Hal Clement Award) (2009), Grand Prix de l'Imaginaire Nominee for Roman jeunesse étranger (2010) ...more","['Young Adult', 'Fiction', 'Science Fiction']"
368,https://www.goodreads.com//book/show/1203471.The_Firebrand,The Firebrand,Marion Zimmer Bradley,4.06,"9,812",465,608,1989,Troy,0,,"['Historical', 'Historical Fiction', 'Fantasy']"
369,https://www.goodreads.com//book/show/44170.The_Looking_Glass_Wars,The Looking Glass Wars,Frank Beddor,3.93,"42,179","3,858",364,2006,,1,Lincoln Award Nominee (2012),"['Fantasy', 'Young Adult', 'Fiction']"
370,https://www.goodreads.com//book/show/3218719-the-ruins-of-gorlan-the-burning-bridge-the-icebound-land,The Ruins of Gorlan / The Burning Bridge / The Icebound Land,John Flanagan,4.49,"10,438",207,848,2008,,1,,"['Fantasy', 'Young Adult', 'Fiction']"
371,https://www.goodreads.com//book/show/27154427-the-wheel-of-osheim,The Wheel of Osheim,Mark Lawrence,4.34,"13,796",904,656,2016,,1,"David Gemmell Legend Award Nominee for Best Fantasy Novel (2017), David Gemmell Ravenheart Award Nominee for Best Fantasy Cover Art (2017), Goodreads Choice Award Nominee for Fantasy (2016)","['Fantasy', 'Fiction', 'Fantasy']"
372,https://www.goodreads.com//book/show/57213211-desert-outcast,Desert Outcast,Juddy Anderson C. Punzalan,4.88,40,12,340,2021,,1,,[]
373,https://www.goodreads.com//book/show/56236618-the-archon-of-peace,The Archon of Peace,Juddy Anderson C. Punzalan,4.79,56,24,795,2020,,1,,['Fantasy']
374,https://www.goodreads.com//book/show/25296.The_Dark_Mirror,The Dark Mirror,Juliet Marillier,3.98,"8,933",496,561,2007,,1,,"['Fantasy', 'Romance', 'Historical']"
375,https://www.goodreads.com//book/show/8942981-son-of-ereubus,Son of Ereubus,J.S. Chancellor,3.66,273,65,292,2010,,1,,"['Fantasy', 'Fantasy', 'Epic Fantasy']"
376,https://www.goodreads.com//book/show/13667.The_Farthest_Shore,The Farthest Shore,Ursula K. Le Guin,4.11,"99,327","2,378",259,2004,Earthsea Realm,1,"National Book Award for Children's Books (1973), Mythopoeic Fantasy Award Nominee (1973), Margaret A. Edwards Award (2004)","['Fantasy', 'Fiction', 'Young Adult']"
377,https://www.goodreads.com//book/show/1051620.The_Innocent_Mage,The Innocent Mage,Karen Miller,3.66,"18,890",920,642,2007,,1,,"['Fantasy', 'Fiction', 'Fantasy']"
378,https://www.goodreads.com//book/show/2015492.Empress,Empress,Karen Miller,3.49,"5,742",545,717,2008,Mijak,1,,"['Fantasy', 'Fiction', 'Fantasy']"
379,https://www.goodreads.com//book/show/149302.Silverthorn,Silverthorn,Raymond E. Feist,4.08,"57,356",912,432,1986,,1,,"['Fantasy', 'Fiction', 'Fantasy']"
380,https://www.goodreads.com//book/show/1022658.The_Ladies_of_Mandrigyn,The Ladies of Mandrigyn,Barbara Hambly,3.96,"3,101",138,311,1984,,1,Locus Award Nominee for Best Fantasy Novel (1985),"['Fantasy', 'Fiction', 'Science Fiction Fantasy']"
381,https://www.goodreads.com//book/show/2408602.The_Red_Wolf_Conspiracy,The Red Wolf Conspiracy,Robert V.S. Redick,3.69,"6,057",350,560,2008,,1,,"['Fantasy', 'Fiction', 'Fantasy']"
382,https://www.goodreads.com//book/show/18006496-queen-of-shadows,Queen of Shadows,Sarah J. Maas,4.54,"281,427","23,415",648,2015,,1,Goodreads Choice Award for Young Adult Fantasy & Science Fiction (2015) and Nominee for Best of the Best (2018),"['Fantasy', 'Young Adult', 'Romance']"
383,https://www.goodreads.com//book/show/13927.Son_of_the_Shadows,Son of the Shadows,Juliet Marillier,4.33,"28,474","1,434",608,2002,,1,Aurealis Award for Best Fantasy Novel (2000),"['Fantasy', 'Romance', 'Historical']"
384,https://www.goodreads.com//book/show/505352.Ravenheart,Ravenheart,David Gemmell,4.27,"6,356",128,427,2002,,1,,"['Fantasy', 'Fiction', 'Fantasy']"
385,https://www.goodreads.com//book/show/10445208-touch-of-power,Touch of Power,Maria V. Snyder,4.14,"42,964","3,315",390,2011,,1,,"['Fantasy', 'Young Adult', 'Fantasy']"
386,https://www.goodreads.com//book/show/258392.Gormenghast,Gormenghast,Mervyn Peake,4.04,"12,228",528,505,1998,Gormenghast,1,W.H. Heinemann Award (1951),"['Fantasy', 'Fiction', 'Classics']"
387,https://www.goodreads.com//book/show/40273980-avaland,Avaland,Amy Croucher Rose,4.59,27,3,342,1,,0,,[]
388,https://www.goodreads.com//book/show/38343303-chasing-the-red-queen,Chasing the Red Queen,Karen Glista,4.27,"2,074",82,277,2018,,0,,"['Fiction', 'Novels', 'Contemporary']"
389,https://www.goodreads.com//book/show/53172026-diplomat-of-uram,Diplomat of Uram,Richard R. Matthews,4.53,32,6,,,,0,,"['Fantasy', 'Fantasy', 'Epic Fantasy']"
390,https://www.goodreads.com//book/show/21535271-the-slow-regard-of-silent-things,The Slow Regard of Silent Things,Patrick Rothfuss,3.89,"122,625","10,977",159,2014,The Underthing,1,"David Gemmell Ravenheart Award Nominee for Best Fantasy Cover Art (2015), Goodreads Choice Award Nominee for Fantasy (2014), Reddit r/fantasy Stabby Award for Best Short Fiction (2014)","['Fantasy', 'Fiction', 'Short Stories']"
391,https://www.goodreads.com//book/show/97967.Mystic_and_Rider,Mystic and Rider,Sharon Shinn,4.09,"9,666",612,432,2006,,1,,"['Fantasy', 'Romance', 'Fantasy']"
392,https://www.goodreads.com//book/show/41423092-the-awakening,The Awakening: Fate in Motion,Suzanne Boisvert,4.31,"6,667",40,331,2018,,0,,"['Contemporary', 'Fiction', 'Drama']"
393,https://www.goodreads.com//book/show/30150701-redstone,Redstone,C.E. Johnson,4.64,86,14,,2016,,1,,['Fantasy']
394,https://www.goodreads.com//book/show/10165727-froi-of-the-exiles,Froi of the Exiles,Melina Marchetta,4.29,"16,607","1,958",593,2011,,1,,"['Fantasy', 'Young Adult', 'Romance']"
395,https://www.goodreads.com//book/show/27837381-bluestone,Bluestone,C.E. Johnson,4.37,129,40,482,2015,,1,,"['Fantasy', 'Young Adult', 'Fantasy']"
396,https://www.goodreads.com//book/show/24148841-rise-of-the-flame,Rise of the Flame,K.N. Lee,3.97,620,96,465,2015,,1,,"['Fantasy', 'Young Adult', 'Fantasy']"
397,https://www.goodreads.com//book/show/6130616-the-magic-kingdom-of-landover-volume-1,"The Magic Kingdom of Landover, Volume 1",Terry Brooks,4.12,"2,998",93,710,2009,,1,,"['Fantasy', 'Fiction', 'Epic']"
398,https://www.goodreads.com//book/show/6657006-the-dwarves,The Dwarves,Markus Heitz,3.95,"10,848",757,736,2009,Geborgene Land,1,,"['Fantasy', 'Fiction', 'Fantasy']"
399,https://www.goodreads.com//book/show/40500762-the-broken-sword,The Broken Sword,Poul Anderson,3.86,"5,549",542,208,2014,,0,,"['Fantasy', 'Fiction', 'Fantasy']"
400,https://www.goodreads.com//book/show/13923.Blade_of_Fortriu,Blade of Fortriu,Juliet Marillier,4.10,"6,207",255,496,2006,"Fortriu, Pictland",1,"Aurealis Award for Best Fantasy Novel (2005), Sir Julius Vogel Award Nominee for Best Novel (2006)","['Fantasy', 'Historical', 'Historical Fiction']"
401,https://www.goodreads.com//book/show/10626594-the-scorpio-races,The Scorpio Races,Maggie Stiefvater,4.06,"104,412","13,189",409,2011,Thisby,0,"Mythopoeic Fantasy Award Nominee for Children's Literature (2012), Odyssey Award Nominee (2012), Los Angeles Times Book Prize Nominee for Young Adult Literature (2011), Michael L. Printz Award Nominee (2012), Milwaukee County Teen Book Award Nominee (2013) ...more","['Fantasy', 'Young Adult', 'Romance']"
402,https://www.goodreads.com//book/show/153220.The_Broken_Crown,The Broken Crown,Michelle West,3.93,"2,945",139,764,1997,,1,,"['Fantasy', 'Fantasy', 'Epic Fantasy']"
403,https://www.goodreads.com//book/show/18138189-tower-lord,Tower Lord,Anthony Ryan,4.17,"41,557","1,838",602,2014,,1,Goodreads Choice Award Nominee for Fantasy (2014),"['Fantasy', 'Fantasy', 'Epic Fantasy']"
404,https://www.goodreads.com//book/show/29247884-the-destroyer-2,The Destroyer 2,Michael-Scott Earle,4.11,"1,682",60,449,2016,,1,,"['Fantasy', 'Adult', 'Fantasy']"
405,https://www.goodreads.com//book/show/15775130-a-man-and-his-god,A Man and His God,Janet E. Morris,4.55,86,27,39,2012,,1,,"['Fantasy', 'Fantasy', 'Heroic Fantasy']"
406,https://www.goodreads.com//book/show/47916.Obernewtyn,Obernewtyn,Isobelle Carmody,3.96,"11,318",775,256,2003,,1,,"['Fantasy', 'Young Adult', 'Science Fiction']"
407,https://www.goodreads.com//book/show/2213661.The_Graveyard_Book,The Graveyard Book,Neil Gaiman,4.13,"460,734","32,750",307,2008,England (United Kingdom),0,"Hugo Award for Best Novel (2009), Newbery Medal (2009), Locus Award for Best Young Adult Novel (2009), World Fantasy Award Nominee for Best Novel (2009), Mythopoeic Fantasy Award Nominee for Children's Literature (2009) ...more","['Fantasy', 'Young Adult', 'Fiction']"
408,https://www.goodreads.com//book/show/13925.Child_of_the_Prophecy,Child of the Prophecy,Juliet Marillier,4.12,"20,452",953,596,2003,,1,Aurealis Award for Fantasy Novel (2001),"['Fantasy', 'Romance', 'Historical']"
409,https://www.goodreads.com//book/show/20174424-city-of-stairs,City of Stairs,Robert Jackson Bennett,4.05,"31,925","3,300",452,2014,,1,"Locus Award Nominee for Best Fantasy Novel (2015), World Fantasy Award Nominee for Best Novel (2015), British Fantasy Award Nominee for Robert Holdstock Award (best fantasy novel) (2015), Goodreads Choice Award Nominee for Fantasy (2014)","['Fantasy', 'Fiction', 'Mystery']"
410,https://www.goodreads.com//book/show/144350.The_Battle_for_Skandia,The Battle for Skandia,John Flanagan,4.34,"82,481","2,051",294,2008,,1,,"['Fantasy', 'Young Adult', 'Adventure']"
411,https://www.goodreads.com//book/show/29394.Cursor_s_Fury,Cursor's Fury,Jim Butcher,4.32,"64,507","1,483",442,2006,Alera,1,,"['Fantasy', 'Fiction', 'Fantasy']"
412,https://www.goodreads.com//book/show/40275288-the-priory-of-the-orange-tree,The Priory of the Orange Tree,Samantha Shannon,4.18,"52,626","10,256",848,2019,,0,"Lambda Literary Award Nominee for LGBT Science Fiction/Fantasy/Horror (2019), Goodreads Choice Award Nominee for Fantasy (2019)","['Fantasy', 'Fiction', 'LGBT']"
413,https://www.goodreads.com//book/show/18243700-the-assassin-s-blade,The Assassin's Blade,Sarah J. Maas,4.37,"158,718","14,805",448,2014,Erilea,1,,"['Fantasy', 'Young Adult', 'Romance']"
414,https://www.goodreads.com//book/show/24689551-the-ix,The IX,Andrew P. Weston,3.42,441,72,596,2015,,1,,"['Science Fiction', 'Fantasy', 'Historical']"
415,https://www.goodreads.com//book/show/8801543-among-thieves,Among Thieves,Douglas Hulick,3.94,"12,238",706,414,2011,,1,"Grand Prix de l'Imaginaire Nominee for Roman étranger (2013), David Gemmell Morningstar Award Nominee for Best Fantasy Newcomer (2012), The Kitschies Nominee for Golden Tentacle (Debut) (2011), David Gemmell Ravenheart Award Nominee for Best Fantasy Cover Art (2012)","['Fantasy', 'Fiction', 'Fantasy']"
416,https://www.goodreads.com//book/show/33022673-king-s-lament,King's Lament,Lilia Blanc,3.63,78,27,488,2016,,0,,"['Fantasy', 'LGBT', 'Romance']"
417,https://www.goodreads.com//book/show/36617106-epic-of-lilith,Epic of Lilith,Ivars Ozols,4.26,23,5,,2017,,0,,[]
418,https://www.goodreads.com//book/show/42778691-the-oracle-s-journal,The Oracle's Journal (Of Gods and Guardians #1),Dimitri Liountris,4.41,27,11,1026,2018,,0,,[]
419,https://www.goodreads.com//book/show/13737.The_Twelve_Kingdoms,The Twelve Kingdoms: Sea of Shadow,Fuyumi Ono,4.20,"2,654",188,464,2007,,1,,"['Fantasy', 'Young Adult', 'Sequential Art']"
420,https://www.goodreads.com//book/show/13810.Magician,Magician: Master,Raymond E. Feist,4.22,"70,119",804,499,1993,,1,,"['Fantasy', 'Fiction', 'Fantasy']"
421,https://www.goodreads.com//book/show/89553.Talion,Talion: Revenant,Michael A. Stackpole,4.17,"2,703",135,467,1997,,0,,"['Fantasy', 'Fiction', 'Fantasy']"
422,https://www.goodreads.com//book/show/13503808-desolace,Desolace,Lucian Barnes,3.95,99,39,265,2012,,1,,"['Horror', 'Fantasy', 'Fantasy']"
423,https://www.goodreads.com//book/show/29429881-the-ring-of-truth,The Ring of Truth: The Wisdom of Wagner’s Ring of the Nibelung,Roger Scruton,4.34,213,17,401,2016,,0,,"['Music', 'Philosophy', 'Nonfiction']"
424,https://www.goodreads.com//book/show/97126.The_Talisman_and_Black_House,The Talisman and Black House,Stephen King,4.45,"3,947",42,3500,2003,,1,,"['Horror', 'Fiction', 'Fantasy']"
