,url,title,authorname,avg_rating,num_rat,num_rev,total_pages,ori_year,places,series,awards,genre3
98,https://www.goodreads.com//book/show/40290.Seventh_Son,Seventh Son,Orson Scott Card,3.87,"33,666","1,509",241,1988,United States of America,1,"Hugo Award Nominee for Best Novel (1988), Locus Award for Best Fantasy Novel (1988), World Fantasy Award Nominee for Best Novel (1988), Mythopoeic Fantasy Award (1988), Evergreen Teen Book Award (1991)","['Fantasy', 'Fiction', 'Science Fiction']"
99,https://www.goodreads.com//book/show/1371.The_Iliad,The Iliad,Homer,3.88,"367,658","7,807",683,1999,Troy,0,,"['Classics', 'Poetry', 'Fiction']"
100,https://www.goodreads.com//book/show/233649.The_Great_Hunt,The Great Hunt,Robert Jordan,4.22,"240,149","5,602",705,1991,Tar Valon,1,,"['Fantasy', 'Fiction', 'Fantasy']"
101,https://www.goodreads.com//book/show/68429.The_Well_of_Ascension,The Well of Ascension,Brandon Sanderson,4.35,"308,926","16,606",590,2007,,1,,"['Fantasy', 'Fiction', 'Fantasy']"
102,https://www.goodreads.com//book/show/91964.The_Briar_King,The Briar King,Greg Keyes,3.73,"11,107",404,553,2004,,1,,"['Fantasy', 'Fiction', 'Fantasy']"
103,https://www.goodreads.com//book/show/10762697-the-farseer-trilogy,The Farseer Trilogy,Robin Hobb,4.38,"19,191",361,1952,2013,,1,,"['Fantasy', 'Fiction', 'Fantasy']"
104,https://www.goodreads.com//book/show/36159.Black_Sun_Rising,Black Sun Rising,C.S. Friedman,3.93,"17,801",676,496,2005,,1,,"['Fantasy', 'Science Fiction', 'Fiction']"
105,https://www.goodreads.com//book/show/15985373-emperor-of-thorns,Emperor of Thorns,Mark Lawrence,4.25,"45,484","2,566",434,2013,,1,"David Gemmell Legend Award for Best Fantasy Novel (2014), David Gemmell Ravenheart Award for Best Fantasy Cover Art (2014), Goodreads Choice Award Nominee for Fantasy (2013), Reddit r/fantasy Stabby Award for Best Novel (2013)","['Fantasy', 'Fiction', 'Fantasy']"
106,https://www.goodreads.com//book/show/618177.Legend,Legend,David Gemmell,4.27,"27,599","1,300",345,1994,,1,Prix Tour Eiffel (2002),"['Fantasy', 'Fiction', 'Fantasy']"
107,https://www.goodreads.com//book/show/44659.Pawn_of_Prophecy,Pawn of Prophecy,David Eddings,4.13,"99,160","3,146",304,2004,,1,"Locus Award Nominee for Best Fantasy Novel (1983), Prix Julia Verlanger (1991), Prix Cosmos 2000 (1991)","['Fantasy', 'Fiction', 'Fantasy']"
108,https://www.goodreads.com//book/show/34897.The_Dragon_Reborn,The Dragon Reborn,Robert Jordan,4.25,"224,308","4,463",624,2002,,1,,"['Fantasy', 'Fiction', 'Fantasy']"
109,https://www.goodreads.com//book/show/104085.A_Song_for_Arbonne,A Song for Arbonne,Guy Gavriel Kay,4.21,"12,911",661,509,2002,,0,,"['Fantasy', 'Fiction', 'Historical']"
110,https://www.goodreads.com//book/show/74270.Luck_in_the_Shadows,Luck in the Shadows,Lynn Flewelling,4.08,"18,994","1,224",479,1996,,1,,"['Fantasy', 'LGBT', 'Romance']"
111,https://www.goodreads.com//book/show/6342491-the-demon-king,The Demon King,Cinda Williams Chima,4.12,"73,699","5,302",506,2009,,1,,"['Fantasy', 'Young Adult', 'Fantasy']"
112,https://www.goodreads.com//book/show/537124.Deryni_Rising,Deryni Rising,Katherine Kurtz,3.95,"7,055",249,271,1976,,1,Mythopoeic Fantasy Award Nominee (1971),"['Fantasy', 'Fiction', 'Science Fiction Fantasy']"
113,https://www.goodreads.com//book/show/8667848-a-discovery-of-witches,A Discovery of Witches,Deborah Harkness,4.00,"401,881","37,448",579,2011,"Oxford, England, 2009",1,"SCIBA Award for fiction, Goodreads Choice Award Nominee for Paranormal Fantasy and for Favorite Book and for Goodreads Author (2011)","['Fantasy', 'Fiction', 'Romance']"
114,https://www.goodreads.com//book/show/9533378-hounded,Hounded,Kevin Hearne,4.07,"82,226","6,848",304,2011,"Tempe, Arizona (United States)",1,Goodreads Choice Award Nominee for Paranormal Fantasy (2011),"['Fantasy', 'Fantasy', 'Urban Fantasy']"
115,https://www.goodreads.com//book/show/43916.Magician,Magician,Raymond E. Feist,4.28,"64,438","1,587",681,2009,,1,,"['Fantasy', 'Fiction', 'Fantasy']"
116,https://www.goodreads.com//book/show/6604209-mistborn-trilogy-boxed-set,Mistborn Trilogy Boxed Set,Brandon Sanderson,4.57,"44,222","1,358",2176,2009,,1,,"['Fantasy', 'Fiction', 'Fantasy']"
117,https://www.goodreads.com//book/show/9539.The_Shadow_Rising,The Shadow Rising,Robert Jordan,4.23,"181,040","3,877",1007,1993,,1,,"['Fantasy', 'Fiction', 'Fantasy']"
118,https://www.goodreads.com//book/show/119322.The_Golden_Compass,The Golden Compass,Philip Pullman,3.99,"1,336,491","23,518",399,1996,"Oxford, England",1,"Guardian Children's Fiction Prize (1996), Audie Award for Children's Titles (2000), Lincoln Award Nominee (2005), Carnegie Medal (1995)","['Fantasy', 'Young Adult', 'Fiction']"
119,https://www.goodreads.com//book/show/6437061-the-hundred-thousand-kingdoms,The Hundred Thousand Kingdoms,N.K. Jemisin,3.86,"61,115","5,975",427,2010,,1,"Hugo Award Nominee for Best Novel (2011), Nebula Award Nominee for Best Novel (2010), Locus Award for Best First Novel (2011), World Fantasy Award Nominee for Best Novel (2011), James Tiptree Jr. Award Nominee (2010) ...more","['Fantasy', 'Fiction', 'Romance']"
120,https://www.goodreads.com//book/show/55401.Deadhouse_Gates,Deadhouse Gates,Steven Erikson,4.21,"62,500","2,436",604,2005,,1,"Prix Aurora Award Nominee for Best of the Decade (2017), Chesley Award Nominee for Hardback Cover (2013)","['Fantasy', 'Fantasy', 'Epic Fantasy']"
121,https://www.goodreads.com//book/show/301538.The_Darkness_That_Comes_Before,The Darkness That Comes Before,R. Scott Bakker,3.79,"18,247","1,005",608,2005,,1,,"['Fantasy', 'Fiction', 'Fantasy']"
122,https://www.goodreads.com//book/show/33396914-assassin-s-quest,Assassin's Quest,Robin Hobb,4.17,"125,283","5,112",757,2002,Moonseye,1,,"['Fantasy', 'Fiction', 'Fantasy']"
123,https://www.goodreads.com//book/show/256683.City_of_Bones,City of Bones,Cassandra Clare,4.09,"1,692,822","64,139",485,2007,"New York City, New York, 2007 (United States)",1,"Locus Award Nominee for Best First Novel (2008), Georgia Peach Book Award Nominee for Honor book (2009), South Carolina Book Award Nominee for Young Adult Book Award (2010), Pacific Northwest Library Association Young Reader's Choice Award (2010), Lincoln Award (2010)","['Young Adult', 'Fantasy', 'Paranormal']"
124,https://www.goodreads.com//book/show/671560.The_Bone_Doll_s_Twin,The Bone Doll's Twin,Lynn Flewelling,4.06,"11,862",592,524,2009,,1,,"['Fantasy', 'Fiction', 'Fantasy']"
125,https://www.goodreads.com//book/show/150739.Dealing_with_Dragons,Dealing with Dragons,Patricia C. Wrede,4.12,"88,830","3,648",212,2002,,1,"California Young Readers Medal Nominee for Middle School/Junior High (1993), Minnesota Book Award for Fantasy & Science Fiction (1991)","['Fantasy', 'Young Adult', 'Fantasy']"
126,https://www.goodreads.com//book/show/16793.Stardust,Stardust,Neil Gaiman,4.08,"376,671","19,423",248,2006,Europe,0,"Locus Award Nominee for Best Fantasy Novel (1999), Geffen Award (2000), Mythopoeic Fantasy Award for Adult Literature (1999), ALA Alex Award (2000)","['Fantasy', 'Fiction', 'Romance']"
127,https://www.goodreads.com//book/show/33482.The_Coming_of_Conan_the_Cimmerian,The Coming of Conan the Cimmerian,Robert E. Howard,4.16,"12,079",571,496,2005,Hyboria,1,,"['Fantasy', 'Fiction', 'Short Stories']"
128,https://www.goodreads.com//book/show/81069.The_Forgotten_Beasts_of_Eld,The Forgotten Beasts of Eld,Patricia A. McKillip,4.09,"13,978","1,019",343,2006,,0,"Locus Award Nominee for Best SF Novel (1975), World Fantasy Award for Best Novel (1975), Mythopoeic Fantasy Award Nominee (1975)","['Fantasy', 'Young Adult', 'Fiction']"
129,https://www.goodreads.com//book/show/110692.The_Redemption_of_Althalus,The Redemption of Althalus,David Eddings,3.84,"15,320",532,800,2001,,0,,"['Fantasy', 'Fiction', 'Science Fiction Fantasy']"
130,https://www.goodreads.com//book/show/236093.The_Wonderful_Wizard_of_Oz,The Wonderful Wizard of Oz,L. Frank Baum,3.97,"392,464","13,352",154,1995,Oz,1,Lewis Carroll Shelf Award (1968),"['Classics', 'Fantasy', 'Fiction']"
131,https://www.goodreads.com//book/show/18693743-prince-of-fools,Prince of Fools,Mark Lawrence,4.06,"27,525","2,168",355,2014,,1,"David Gemmell Legend Award Nominee for Best Fantasy Novel (2015), David Gemmell Ravenheart Award Nominee for Best Fantasy Cover Art (2015), Goodreads Choice Award Nominee for Fantasy (2014)","['Fantasy', 'Fiction', 'Fantasy']"
132,https://www.goodreads.com//book/show/902715.Before_They_Are_Hanged,Before They Are Hanged,Joe Abercrombie,4.29,"123,911","4,615",441,2007,,1,,"['Fantasy', 'Fiction', 'Fantasy']"
133,https://www.goodreads.com//book/show/60510.Poison_Study,Poison Study,Maria V. Snyder,4.09,"152,900","12,036",427,2007,Ixia,1,"Locus Award Nominee for Best First Novel (2006), RITA Award by Romance Writers of America Nominee for First Book (2006), Compton Crook Award (2006)","['Fantasy', 'Young Adult', 'Romance']"
134,https://www.goodreads.com//book/show/2248573.Brisingr,Brisingr,Christopher Paolini,4.05,"318,653","9,255",748,2008,Alagaësia,1,,"['Fantasy', 'Young Adult', 'Fiction']"
135,https://www.goodreads.com//book/show/8490112-daughter-of-smoke-bone,Daughter of Smoke & Bone,Laini Taylor,3.99,"331,095","30,033",418,2011,Prague (Praha) (Czech Republic),1,"Locus Award Nominee for Best Young Adult Novel (2012), Audie Award for Fantasy (2012), Rhode Island Teen Book Award Nominee (2013), Milwaukee County Teen Book Award Nominee (2013), Children's Choice Book Award Nominee for Teen Choice Book of the Year (2012) ...more","['Fantasy', 'Young Adult', 'Romance']"
136,https://www.goodreads.com//book/show/498214.Daggerspell,Daggerspell,Katharine Kerr,3.90,"14,602",503,454,1993,,1,Locus Award Nominee for Best Fantasy Novel (1987),"['Fantasy', 'Fiction', 'Fantasy']"
137,https://www.goodreads.com//book/show/6137154-fire,Fire,Kristin Cashore,4.09,"169,802","10,604",480,2009,,1,"Milwaukee County Teen Book Award Nominee (2011), Amelia Elizabeth Walden Award (2010), CYBILS Award for Young Adult Fantasy & Science Fiction (2009), David Gemmell Ravenheart Award Nominee for Best Fantasy Cover Art (2010)","['Fantasy', 'Young Adult', 'Romance']"
138,https://www.goodreads.com//book/show/944076.Last_Argument_of_Kings,Last Argument of Kings,Joe Abercrombie,4.28,"116,649","4,988",536,2008,,1,David Gemmell Legend Award Nominee for Best Fantasy Novel (2009),"['Fantasy', 'Fiction', 'Fantasy']"
139,https://www.goodreads.com//book/show/448873.The_Thief,The Thief,Megan Whalen Turner,3.86,"74,878","8,131",280,2005,,1,"Newbery Medal Nominee (1997), Mythopoeic Fantasy Award for Children’s Literature (2011), Dorothy Canfield Fisher Children's Book Award Nominee (1998)","['Fantasy', 'Young Adult', 'Fiction']"
140,https://www.goodreads.com//book/show/231989.The_Wayfarer_Redemption,The Wayfarer Redemption,Sara Douglass,3.95,"16,175",451,629,2001,,1,,"['Fantasy', 'Fiction', 'Fantasy']"
141,https://www.goodreads.com//book/show/30165203-american-gods,American Gods,Neil Gaiman,4.10,"793,463","39,886",635,2011,United States of America,1,"Bram Stoker Award for Best Novel (2001), Hugo Award for Best Novel (2002), Nebula Award for Best Novel (2002), Locus Award for Best Fantasy Novel (2002), International Horror Guild Award Nominee for Best Novel (2001) ...more","['Fantasy', 'Fiction', 'Fantasy']"
142,https://www.goodreads.com//book/show/15575.The_Sword_of_Shannara,The Sword of Shannara,Terry Brooks,3.76,"90,880","4,196",726,1999,,1,Locus Award Nominee for Best Fantasy Novel (1978),"['Fantasy', 'Fiction', 'Fantasy']"
143,https://www.goodreads.com//book/show/16031258-the-steward,The Steward,Christopher Shields,3.92,561,95,336,2012,,1,,"['Fantasy', 'Fairies', 'Fae']"
144,https://www.goodreads.com//book/show/52357.Beowulf,Beowulf,Unknown,3.46,"251,445","6,961",245,2001,Denmark,0,,"['Classics', 'Poetry', 'Fiction']"
145,https://www.goodreads.com//book/show/13626269-shadows-of-the-realm,Shadows of the Realm,Dionne Lister,3.83,348,75,474,2012,,1,,"['Fantasy', 'Fantasy', 'Dragons']"
146,https://www.goodreads.com//book/show/40604556-red-seas-under-red-skies,Red Seas Under Red Skies,Scott Lynch,4.22,"119,609","6,148",578,2018,,1,Grand Prix de l'Imaginaire for Roman étranger (2008),"['Fantasy', 'Fiction', 'Adventure']"
147,https://www.goodreads.com//book/show/23258641-van-laven-chronicles,Van Laven Chronicles: Throne of Novoxos,Tyler Chase,3.53,"3,060",130,437,,,1,,"['Science Fiction', 'Fantasy', 'Romance']"
148,https://www.goodreads.com//book/show/9300768-the-heroes,The Heroes,Joe Abercrombie,4.31,"44,323","2,286",581,2011,,1,"Locus Award Nominee for Best Fantasy Novel (2012), David Gemmell Legend Award Nominee for Best Fantasy Novel (2012), British Fantasy Award Nominee for Best Novel (2012), David Gemmell Ravenheart Award Nominee for Best Fantasy Cover Art (2012), Goodreads Choice Award Nominee for Fantasy (2011)","['Fantasy', 'Fiction', 'Fantasy']"
149,https://www.goodreads.com//book/show/51476294-adhaata-asao-s-liege,Adhaata Asao's Liege,Afroz Alam,4.66,128,87,174,2020,,0,,['Fantasy']
150,https://www.goodreads.com//book/show/25300956-royal-assassin,Royal Assassin,Robin Hobb,4.22,"158,500","5,032",675,2002,,1,Locus Award Nominee for Best Fantasy Novel (1997),"['Fantasy', 'Fiction', 'Fantasy']"
151,https://www.goodreads.com//book/show/20406003-the-stones-of-andarus,The Stones of Andarus,Tom Sechrist,4.39,119,7,474,2012,,1,,"['Fantasy', 'Fantasy', 'Epic Fantasy']"
152,https://www.goodreads.com//book/show/144127.The_Runelords,The Runelords,David Farland,3.76,"18,045",521,613,1999,,1,,"['Fantasy', 'Fiction', 'Fantasy']"
153,https://www.goodreads.com//book/show/19161852-the-fifth-season,The Fifth Season,N.K. Jemisin,4.28,"172,449","19,270",468,2015,,1,"Hugo Award for Best Novel (2016), Nebula Award Nominee for Best Novel (2015), Locus Award Nominee for Best Fantasy Novel (2016), World Fantasy Award Nominee for Best Novel (2016), Grand Prix de l'Imaginaire Nominee for Traduction (2018) (2019) ...more","['Fantasy', 'Fiction', 'Science Fiction']"
154,https://www.goodreads.com//book/show/4932435-finnikin-of-the-rock,Finnikin of the Rock,Melina Marchetta,3.87,"46,928","4,494",416,2008,,1,"Children's Book Council of Australia Award Nominee for Book of the Year - Older Readers (2009), Aurealis Award for Young Adult Novel (2008), Sakura Medal Nominee for High School Book (2010), Lincoln Award Nominee (2013), Australian Book Industry Award (ABIA) for Older Children (ages 8-14) (2009) ...more","['Fantasy', 'Young Adult', 'Romance']"
155,https://www.goodreads.com//book/show/153007.Kushiel_s_Scion,Kushiel's Scion,Jacqueline Carey,4.21,"20,186",636,944,2007,,1,,"['Fantasy', 'Romance', 'Fiction']"
156,https://www.goodreads.com//book/show/34002132-oathbringer,Oathbringer,Brandon Sanderson,4.58,"147,504","9,406",1248,2017,,1,"David Gemmell Legend Award Nominee for Best Fantasy Novel (2018), David Gemmell Ravenheart Award Nominee for Best Fantasy Cover Art (2018), Goodreads Choice Award Nominee for Fantasy (2017), BookNest Award Nominee for Best Traditionally Published Novel (2018)","['Fantasy', 'Fiction', 'Fantasy']"
157,https://www.goodreads.com//book/show/9361589-the-night-circus,The Night Circus,Erin Morgenstern,4.03,"732,787","77,401",391,2011,"London, England (United Kingdom)",0,"Locus Award for Best First Novel (2012), Orange Prize Nominee for Fiction Longlist (2012), Guardian First Book Award Nominee for Longlist (2011), Mythopoeic Fantasy Award Nominee for Adult Literature (2012), ALA Alex Award (2012) ...more","['Fantasy', 'Fiction', 'Romance']"
158,https://www.goodreads.com//book/show/21533892-predator-prey,Predator & Prey,Tom Sechrist,4.57,103,7,441,2014,,1,,['Fantasy']
159,https://www.goodreads.com//book/show/7664041-inheritance,Inheritance,Christopher Paolini,4.09,"229,924","10,372",849,2011,Alagaësia,1,Premio El Templo de las Mil Puertas Nominee for Mejor novela extranjera perteneciente a saga (2011),"['Fiction', 'Young Adult', 'Adventure']"
160,https://www.goodreads.com//book/show/651260.Domes_of_Fire,Domes of Fire,David Eddings,4.01,"26,871",216,471,1993,,1,,"['Fantasy', 'Fiction', 'Fantasy']"
161,https://www.goodreads.com//book/show/17886664-switch-the-lost-kingdoms-of-karibu,Switch! The Lost Kingdoms of Karibu,Karen Prince,4.14,482,77,276,2012,"Lost Kingdom, Africa, 2014 (Zimbabwe)",1,Kindle Book Award Nominee for Young Adult (Semi-Finalist) (2013),"['Fantasy', 'Young Adult', 'Humor']"
162,https://www.goodreads.com//book/show/52640.Weaveworld,Weaveworld,Clive Barker,4.13,"28,983","1,269",721,2001,,0,"Locus Award Nominee for Best Fantasy Novel (1988), World Fantasy Award Nominee for Best Novel (1988), Prix Cosmos 2000 (1990)","['Fantasy', 'Horror', 'Fiction']"
163,https://www.goodreads.com//book/show/104097.Sailing_to_Sarantium,Sailing to Sarantium,Guy Gavriel Kay,4.17,"13,073",613,448,2002,,1,"World Fantasy Award Nominee for Best Novel (1999), Mythopoeic Fantasy Award Nominee for Adult Literature (2001), Prix Aurora Award Nominee for Best Long-Form Work in English (1999)","['Fantasy', 'Historical', 'Historical Fiction']"
164,https://www.goodreads.com//book/show/23753.The_Absolute_Sandman_Volume_One,"The Absolute Sandman, Volume One",Neil Gaiman,4.65,"18,245",633,612,2006,,1,IGN Award for Best Collection (2006),"['Sequential Art', 'Comics', 'Sequential Art']"
165,https://www.goodreads.com//book/show/45978.Eldest,Eldest,Christopher Paolini,3.99,"376,110","9,880",704,2007,Alagaësia,1,"West Australian Young Readers' Book Award (WAYRBA) for Older Readers (2006), Colorado Blue Spruce Young Adult Book Award (2007), Teen Buckeye Book Award (2007), Soaring Eagle Book Award (2006)","['Fantasy', 'Young Adult', 'Fiction']"
166,https://www.goodreads.com//book/show/13661.Tehanu,Tehanu,Ursula K. Le Guin,3.94,"41,202","1,971",281,2004,Earthsea Realm,1,"Nebula Award for Best Novel (1990), Locus Award for Best Fantasy Novel (1991), Mythopoeic Fantasy Award Nominee (1991), Margaret A. Edwards Award (2004)","['Fantasy', 'Fiction', 'Young Adult']"
167,https://www.goodreads.com//book/show/393146.The_Naming,The Naming,Alison Croggon,4.02,"24,607","1,613",492,2006,,1,,"['Fantasy', 'Young Adult', 'Fiction']"
168,https://www.goodreads.com//book/show/259836.Dragons_of_Autumn_Twilight,Dragons of Autumn Twilight,Margaret Weis,3.99,"111,929","2,270",444,2000,,1,,"['Fantasy', 'Dungeons and Dragons', 'Dragonlance']"
169,https://www.goodreads.com//book/show/8752885-the-dragon-s-path,The Dragon's Path,Daniel Abraham,3.79,"19,148","1,383",555,2011,,1,,"['Fantasy', 'Fantasy', 'Epic Fantasy']"
170,https://www.goodreads.com//book/show/9542.Cast_in_Shadow,Cast in Shadow,Michelle Sagara,3.79,"16,342","1,032",507,2005,,1,,"['Fantasy', 'Fantasy', 'Urban Fantasy']"
171,https://www.goodreads.com//book/show/11100431-heir-of-novron,Heir of Novron,Michael J. Sullivan,4.49,"41,577","2,287",932,2012,,1,,"['Fantasy', 'Fiction', 'Fantasy']"
172,https://www.goodreads.com//book/show/25895524-red-sister,Red Sister,Mark Lawrence,4.15,"49,295","4,862",469,2017,,1,"David Gemmell Legend Award Nominee for Best Fantasy Novel (2018), Goodreads Choice Award Nominee for Fantasy (2017), Reddit r/fantasy Stabby Award for Best Novel (2017), BookNest Award Nominee for Best Traditionally Published Novel (2017)","['Fantasy', 'Fiction', 'Adult']"
173,https://www.goodreads.com//book/show/12499290-the-blinding-knife,The Blinding Knife,Brent Weeks,4.39,"78,644","2,570",671,2012,,1,"David Gemmell Legend Award for Fantasy Novel (2013), Endeavour Award Nominee (2013), David Gemmell Ravenheart Award Nominee for Best Fantasy Cover Art (2013), Goodreads Choice Award Nominee for Fantasy (2012), Reddit r/fantasy Stabby Award for Best Novel (2012)","['Fantasy', 'Fantasy', 'Epic Fantasy']"
174,https://www.goodreads.com//book/show/3754016-shadow-s-edge,Shadow's Edge,Brent Weeks,4.24,"95,984","2,074",636,2008,Midcyru,1,,"['Fantasy', 'Fiction', 'Fantasy']"
175,https://www.goodreads.com//book/show/6043781-blood-of-elves,Blood of Elves,Andrzej Sapkowski,4.10,"123,287","6,329",420,2009,,1,"David Gemmell Legend Award for Best Fantasy Novel (2009), Janusz A. Zajdel Award for Novel (1995)","['Fantasy', 'Fiction', 'Audiobook']"
176,https://www.goodreads.com//book/show/3754026-beyond-the-shadows,Beyond the Shadows,Brent Weeks,4.25,"92,501","2,224",689,2008,Midcyru,1,,"['Fantasy', 'Fiction', 'Fantasy']"
177,https://www.goodreads.com//book/show/68806.The_Elenium,The Elenium: The Diamond Throne / The Ruby Knight / The Sapphire Rose,David Eddings,4.21,"5,599",120,902,2007,,1,,"['Fantasy', 'Fiction', 'Fantasy']"
178,https://www.goodreads.com//book/show/28660.The_Curse_of_the_Mistwraith,The Curse of the Mistwraith,Janny Wurts,3.76,"5,271",270,830,2009,,1,,"['Fantasy', 'Fantasy', 'Epic Fantasy']"
179,https://www.goodreads.com//book/show/567704.Imajica,Imajica,Clive Barker,4.17,"20,992",916,823,1997,,0,Prix Julia Verlanger (1997),"['Fantasy', 'Horror', 'Fiction']"
180,https://www.goodreads.com//book/show/43763.Interview_with_the_Vampire,Interview with the Vampire,Anne Rice,4.00,"503,725","10,751",342,2004,"New Orleans, Louisiana (United States)",1,British Fantasy Award Nominee for Best Novel (1977),"['Horror', 'Fantasy', 'Fiction']"
181,https://www.goodreads.com//book/show/40159.The_King_of_Attolia,The King of Attolia,Megan Whalen Turner,4.38,"34,165","3,114",387,2006,,1,"Dorothy Canfield Fisher Children's Book Award Nominee (2008), Andre Norton Award Nominee (2006)","['Fantasy', 'Young Adult', 'Fiction']"
182,https://www.goodreads.com//book/show/16043804-the-crown-tower,The Crown Tower,Michael J. Sullivan,4.33,"31,619","1,734",384,2013,,1,Goodreads Choice Award Nominee for Fantasy (2013),"['Fantasy', 'Fiction', 'Fantasy']"
183,https://www.goodreads.com//book/show/17910124-the-emperor-s-blades,The Emperor's Blades,Brian Staveley,4.05,"38,997","2,506",480,2014,,1,"Locus Award Nominee for Best First Novel (2015), David Gemmell Morningstar Award (2015), Goodreads Choice Award Nominee for Fantasy & for Debut Goodreads Author (2014), Reddit r/fantasy Stabby Award for Best Debut Novel (2014)","['Fantasy', 'Fantasy', 'Epic Fantasy']"
184,https://www.goodreads.com//book/show/10790277-rise-of-empire,Rise of Empire,Michael J. Sullivan,4.37,"42,869","1,827",786,2011,,1,,"['Fantasy', 'Fantasy', 'Epic Fantasy']"
185,https://www.goodreads.com//book/show/24067691-der-ring-des-nibelungen,Der Ring des Nibelungen,Richard Wagner,4.32,738,62,134,2013,,1,,"['Classics', 'Music', 'Poetry']"
186,https://www.goodreads.com//book/show/977841.The_Alchemyst,The Alchemyst,Michael Scott,3.84,"148,640","8,510",375,2007,"San Francisco, California (United States)",1,"Rhode Island Teen Book Award (2009), Iowa Teen Award Nominee (2011), Rebecca Caudill Young Readers' Book Award Nominee (2011)","['Fantasy', 'Young Adult', 'Fiction']"
187,https://www.goodreads.com//book/show/55777051-horn-horn,Horn-Horn: A small-town supernatural black-comedy,A.D.T. McLellan,4.51,85,56,437,2020,,1,,"['Fantasy', 'Horror', 'LGBT']"
188,https://www.goodreads.com//book/show/15750692-malice,Malice,John Gwynne,4.14,"18,017","1,984",672,2012,,1,David Gemmell Morningstar Award for Best Fantasy Newcomer (2013),"['Fantasy', 'Fantasy', 'Epic Fantasy']"
189,https://www.goodreads.com//book/show/124153.Death_Devoted_Heart,Death-Devoted Heart: Sex and the Sacred in Wagner's Tristan and Isolde,Roger Scruton,4.13,120,7,238,2003,,0,,"['Philosophy', 'Music', 'Nonfiction']"
190,https://www.goodreads.com//book/show/20613470-heir-of-fire,Heir of Fire,Sarah J. Maas,4.46,"325,580","26,862",565,2014,"Rifthold, Adarlan",1,Goodreads Choice Award Nominee for Young Adult Fantasy & Science Fiction (2014),"['Fantasy', 'Young Adult', 'Romance']"
191,https://www.goodreads.com//book/show/164152.The_Tristan_Chord,The Tristan Chord: Wagner and Philosophy,Bryan Magee,4.37,482,32,424,2002,,0,,"['Philosophy', 'Music', 'Nonfiction']"
192,https://www.goodreads.com//book/show/552357.Thieves_World,Thieves' World,Robert Lynn Asprin,3.84,"7,410",192,308,1982,Sanctuary,1,"Locus Award Nominee for Best Anthology (1980), World Fantasy Award Nominee for Best Anthology/Collection (1980), Balrog Award Nominee for Best Collection/Anthology (1980)","['Fantasy', 'Fiction', 'Anthologies']"
193,https://www.goodreads.com//book/show/17167166-crown-of-midnight,Crown of Midnight,Sarah J. Maas,4.39,"390,483","31,149",420,2013,"Rifthold, Adarlan",1,Goodreads Choice Award Nominee for Young Adult Fantasy & Science Fiction (2013),"['Fantasy', 'Young Adult', 'Romance']"
194,https://www.goodreads.com//book/show/7329.Unfinished_Tales_of_N_menor_and_Middle_Earth,Unfinished Tales of Númenor and Middle-Earth,J.R.R. Tolkien,3.93,"35,644",805,452,2000,Middle-earth,1,"Locus Award Nominee for Best Single Author Collection (1981), Mythopoeic Fantasy Award (1981), Balrog Award for Best Collection/Anthology (1981)","['Fantasy', 'Fiction', 'Classics']"
195,https://www.goodreads.com//book/show/28248.Priestess_of_the_White,Priestess of the White,Trudi Canavan,3.86,"15,751",519,598,2006,,1,,"['Fantasy', 'Fantasy', 'High Fantasy']"
196,https://www.goodreads.com//book/show/7743175-a-memory-of-light,A Memory of Light,Robert Jordan,4.50,"114,939","6,311",912,2013,,1,"David Gemmell Legend Award Nominee for Best Fantasy Novel (2014), Goodreads Choice Award Nominee for Fantasy (2013)","['Fantasy', 'Fiction', 'Fantasy']"
197,https://www.goodreads.com//book/show/22845353-circle-of-reign,Circle of Reign,Jacob Cooper,3.93,821,115,616,2014,,1,,"['Fantasy', 'Audiobook', 'Fantasy']"
198,https://www.goodreads.com//book/show/176843.The_Outstretched_Shadow,The Outstretched Shadow,Mercedes Lackey,4.02,"10,714",380,604,2003,,1,,"['Fantasy', 'Fiction', 'Fantasy']"
199,https://www.goodreads.com//book/show/14201.Jonathan_Strange_Mr_Norrell,Jonathan Strange & Mr Norrell,Susanna Clarke,3.82,"210,789","14,679",1006,2006,"United Kingdom, 1806",0,"Hugo Award for Best Novel (2005), Booker Prize Nominee for Longlist (2004), Nebula Award Nominee for Best Novel (2005), Locus Award for Best First Novel and Nominee for Best Fantasy Novel (2005), Guardian First Book Award Nominee (2004) ...more","['Fantasy', 'Fiction', 'Historical']"
