,url,title,authorname,avg_rating,num_rat,num_rev,total_pages,ori_year,places,series,awards,genre3
200,https://www.goodreads.com//book/show/102266.Ill_Met_in_Lankhmar,Ill Met in Lankhmar,Fritz Leiber,4.16,"2,763",80,494,1991,,1,"Hugo Award for Best Novella (1971), Nebula Award for Best Novella (1970)","['Fantasy', 'Fiction', 'Heroic Fantasy']"
201,https://www.goodreads.com//book/show/61904.Paladin_of_Souls,Paladin of Souls,Lois McMaster Bujold,4.16,"22,117","1,278",470,2005,,1,"Hugo Award for Best Novel (2004), Nebula Award for Best Novel (2004), Locus Award for Best Fantasy Novel (2004), Mythopoeic Fantasy Award Nominee for Adult Literature (2004)","['Fantasy', 'Fiction', 'Hugo Awards']"
202,https://www.goodreads.com//book/show/23754.Preludes_Nocturnes,Preludes & Nocturnes,Neil Gaiman,4.23,"222,003","6,560",233,1998,,1,,"['Sequential Art', 'Graphic Novels', 'Sequential Art']"
203,https://www.goodreads.com//book/show/68520.The_Winter_King,The Winter King,Bernard Cornwell,4.26,"38,879","1,805",433,1997,Britain,1,,"['Historical', 'Historical Fiction', 'Fantasy']"
204,https://www.goodreads.com//book/show/768878.Abarat,Abarat,Clive Barker,4.09,"26,080","1,430",393,2003,,1,Borders Original Voices Award for YA or Independent Reader (2002),"['Fantasy', 'Young Adult', 'Fiction']"
205,https://www.goodreads.com//book/show/672875.Le_Morte_d_Arthur,Le Morte d'Arthur: King Arthur and the Legends of the Round Table,Thomas Malory,3.92,"35,190",971,512,2001,Logres (United Kingdom),0,,"['Classics', 'Fantasy', 'Fiction']"
206,https://www.goodreads.com//book/show/64401.Another_Fine_Myth,Another Fine Myth,Robert Lynn Asprin,4.05,"22,063",651,200,2005,Klah,1,,"['Fantasy', 'Humor', 'Fiction']"
207,https://www.goodreads.com//book/show/99461.Split_Infinity,Split Infinity,Piers Anthony,3.97,"16,784",392,368,1987,,1,Locus Award Nominee for Best Fantasy Novel (1981),"['Fantasy', 'Science Fiction', 'Fiction']"
208,https://www.goodreads.com//book/show/76620.Watership_Down,Watership Down,Richard Adams,4.06,"446,115","14,257",478,1975,"Watership Down, Hampshire (United Kingdom)",1,"Mythopoeic Fantasy Award Nominee (1975), Guardian Children's Fiction Prize (1973), Audie Award Nominee for Best Male Narrator (2020), Boston Globe-Horn Book Award (1975), California Young Readers Medal for Young Adult (1977) ...more","['Classics', 'Fiction', 'Fantasy']"
209,https://www.goodreads.com//book/show/149267.The_Stand,The Stand,Stephen King,4.34,"646,402","22,442",1152,1990,United States of America,0,"Locus Award Nominee for Best SF Novel (1979), World Fantasy Award Nominee for Best Novel (1979), Gandalf Award Nominee (1979), Balrog Award Nominee for Best Novel (1979) (1980)","['Horror', 'Fiction', 'Fantasy']"
210,https://www.goodreads.com//book/show/6101718-the-magicians,The Magicians,Lev Grossman,3.52,"243,660","22,751",402,2009,New York State (United States),1,"ALA Alex Award (2010), The Kitschies Nominee for Red Tentacle (Novel) (2009), Goodreads Choice Award Nominee for Fiction & Fantasy (2009)","['Fantasy', 'Fiction', 'Fantasy']"
211,https://www.goodreads.com//book/show/62292.Sword_in_the_Storm,Sword in the Storm,David Gemmell,4.27,"10,433",307,439,2001,,1,,"['Fantasy', 'Fiction', 'Fantasy']"
212,https://www.goodreads.com//book/show/19351.The_Epic_of_Gilgamesh,The Epic of Gilgamesh,Anonymous,3.70,"83,563","4,362",120,2006,"Ur, Mesopotamia",0,,"['Classics', 'Poetry', 'Fiction']"
213,https://www.goodreads.com//book/show/45108.Fool_s_Fate,Fool's Fate,Robin Hobb,4.43,"64,953","1,892",914,2004,Aslevjal,1,,"['Fantasy', 'Fantasy', 'Dragons']"
214,https://www.goodreads.com//book/show/769483.Magyk,Magyk,Angie Sage,3.82,"115,501","5,213",564,2005,,1,Deutscher Jugendliteraturpreis Nominee for Preis der Jugendjury (2006),"['Fantasy', 'Young Adult', 'Fantasy']"
215,https://www.goodreads.com//book/show/3.Harry_Potter_and_the_Sorcerer_s_Stone,Harry Potter and the Sorcerer's Stone,J.K. Rowling,4.48,"7,504,311","118,949",309,2003,"London, England, 1991 (United Kingdom)",1,"Mythopoeic Fantasy Award for Children's Literature (2008), British Book Award for Children's Book of the Year (1998), Prijs van de Nederlandse Kinderjury for 6-9 jaar en 10-12 jaar (2002), American Booksellers Book Of The Year Award for Children (1999), Audie Award (2000) ...more","['Fantasy', 'Fiction', 'Young Adult']"
216,https://www.goodreads.com//book/show/21060.Crown_Duel,Crown Duel,Sherwood Smith,4.19,"24,363","1,047",471,2002,,1,,"['Fantasy', 'Young Adult', 'Romance']"
217,https://www.goodreads.com//book/show/13890.A_Crown_of_Swords,A Crown of Swords,Robert Jordan,4.03,"132,767","2,493",880,1997,,1,SFBC Award (1996),"['Fantasy', 'Fiction', 'Fantasy']"
218,https://www.goodreads.com//book/show/13829.Terrier,Terrier,Tamora Pierce,4.10,"69,301","1,997",581,2006,Tortall,1,"Mythopoeic Fantasy Award Nominee for Children's Literature (2012), West Australian Young Readers' Book Award (WAYRBA) for Older Readers (2009), Missouri Gateway Readers Award Nominee (2009)","['Fantasy', 'Young Adult', 'Fiction']"
219,https://www.goodreads.com//book/show/28694.Shadowmarch,Shadowmarch,Tad Williams,3.74,"11,394",504,796,2006,,1,Locus Award Nominee for Best Fantasy Novel (2005),"['Fantasy', 'Fiction', 'Fantasy']"
220,https://www.goodreads.com//book/show/25188051-fireborn,Fireborn,James Dwyer,4.32,68,13,715,2015,,0,,"['Fantasy', 'Young Adult', 'Young Adult Fantasy']"
221,https://www.goodreads.com//book/show/13895.The_Fires_of_Heaven,The Fires of Heaven,Robert Jordan,4.15,"146,652","3,224",912,1994,,1,,"['Fantasy', 'Fiction', 'Fantasy']"
222,https://www.goodreads.com//book/show/18364299-haven-of-dante,Haven of Dante: The Staff of Moshe,Leonardo Ramirez,4.31,51,13,410,2013,,0,,[]
223,https://www.goodreads.com//book/show/11557.Swan_Song,Swan Song,Robert R. McCammon,4.28,"57,133","3,736",956,1987,"New York City, New York (United States)",0,"Bram Stoker Award for Best Novel (1987), World Fantasy Award Nominee for Best Novel (1988), Japan Adventure Fiction Association Prize 日本冒険小説協会大賞特別賞 for Best Translated Novel (1994)","['Horror', 'Fiction', 'Apocalyptic']"
224,https://www.goodreads.com//book/show/40866.Tales_of_the_Dying_Earth,Tales of the Dying Earth,Jack Vance,4.14,"4,972",390,741,2000,,1,,"['Fantasy', 'Science Fiction', 'Fiction']"
225,https://www.goodreads.com//book/show/153784.First_Test,First Test,Tamora Pierce,4.18,"60,361","1,523",240,2000,Tortall,1,Margaret A. Edwards Award (2013),"['Fantasy', 'Young Adult', 'Fiction']"
226,https://www.goodreads.com//book/show/24431.Trickster_s_Choice,Trickster's Choice,Tamora Pierce,4.20,"66,363","1,496",453,2004,,1,,"['Fantasy', 'Young Adult', 'Fiction']"
227,https://www.goodreads.com//book/show/22544764-uprooted,Uprooted,Naomi Novik,4.05,"183,812","23,438",435,2015,,0,"Hugo Award Nominee for Best Novel (2016), Nebula Award for Best Novel (2015), Locus Award for Best Fantasy Novel (2016), World Fantasy Award Nominee for Best Novel (2016), Mythopoeic Fantasy Award for Adult Literature (2016) ...more","['Fantasy', 'Young Adult', 'Fiction']"
228,https://www.goodreads.com//book/show/15790883-promise-of-blood,Promise of Blood,Brian McClellan,4.10,"47,476","3,038",545,2013,"Adopest, Adro",1,"David Gemmell Morningstar Award for Best Fantasy Newcomer (2014), David Gemmell Ravenheart Award Nominee for Best Fantasy Cover Art (2014), Goodreads Choice Award Nominee for Fantasy and for Debut Author (2013), Reddit r/fantasy Stabby Award for Best Debut Novel (2013)","['Fantasy', 'Fiction', 'Fantasy']"
229,https://www.goodreads.com//book/show/177250.The_Mirror_of_Her_Dreams,The Mirror of Her Dreams,Stephen R. Donaldson,3.92,"13,184",419,654,2003,Mordant,1,"Prix Julia Verlanger (1990), SFBC Award (1987)","['Fantasy', 'Fiction', 'Science Fiction Fantasy']"
230,https://www.goodreads.com//book/show/29137.The_Baker_s_Boy,The Baker's Boy,J.V. Jones,3.79,"7,657",172,552,1997,,1,,"['Fantasy', 'Fiction', 'Fantasy']"
231,https://www.goodreads.com//book/show/618196.Transformation,Transformation,Carol Berg,3.99,"6,921",351,439,2000,,1,"Geffen Award, Compton Crook Award Nominee (2001)","['Fantasy', 'Fiction', 'Fantasy']"
232,https://www.goodreads.com//book/show/264069.The_Witches_of_Eileanan,The Witches of Eileanan,Kate Forsyth,4.01,"6,361",317,411,1998,,1,,"['Fantasy', 'Paranormal', 'Witches']"
233,https://www.goodreads.com//book/show/37442.Wicked,Wicked: The Life and Times of the Wicked Witch of the West,Gregory Maguire,3.54,"581,371","24,742",406,2000,Oz,1,Tähtifantasia Award Nominee (2009),"['Fantasy', 'Fiction', 'Adult']"
234,https://www.goodreads.com//book/show/15177.Bridge_of_Birds,Bridge of Birds,Barry Hughart,4.29,"9,672","1,070",278,1985,China,1,"World Fantasy Award for Best Novel (1985), Mythopoeic Fantasy Award (1986)","['Fantasy', 'Fiction', 'Historical']"
235,https://www.goodreads.com//book/show/11149.The_Screwtape_Letters,The Screwtape Letters,C.S. Lewis,4.23,"349,732","12,002",224,2001,,0,"Nautilus Book Award for Audio Books & Spoken Word (2010), Audie Award for Classic (2000)","['Fiction', 'Classics', 'Christian']"
236,https://www.goodreads.com//book/show/104080.The_Last_Light_of_the_Sun,The Last Light of the Sun,Guy Gavriel Kay,3.94,"8,161",488,501,2005,,0,"Locus Award Nominee for Best SF Novel (2005), Sunburst Award Nominee for Canadian Novel (2005)","['Fantasy', 'Historical', 'Historical Fiction']"
237,https://www.goodreads.com//book/show/116563.So_You_Want_to_Be_a_Wizard,So You Want to Be a Wizard,Diane Duane,3.83,"25,892","1,183",323,2003,"New York City, New York (United States)",1,,"['Fantasy', 'Young Adult', 'Fiction']"
238,https://www.goodreads.com//book/show/12680907-bitterblue,Bitterblue,Kristin Cashore,3.98,"108,529","8,285",576,2012,,1,"The Inky Awards Nominee for Silver Inky (2012), NAIBA Book of the Year for Young Adults (2012), Goodreads Choice Award Nominee for Young Adult Fantasy & Science Fiction (2012), Premio El Templo de las Mil Puertas Nominee for Mejor novela extranjera perteneciente a saga (2012)","['Fantasy', 'Young Adult', 'Romance']"
239,https://www.goodreads.com//book/show/34.The_Fellowship_of_the_Ring,The Fellowship of the Ring,J.R.R. Tolkien,4.37,"2,441,061","24,801",398,2003,Middle-earth,1,Publieksprijs voor het Nederlandse Boek Nominee (2002),"['Fantasy', 'Classics', 'Fiction']"
240,https://www.goodreads.com//book/show/16488.The_Complete_Book_of_Swords,The Complete Book of Swords,Fred Saberhagen,4.05,"3,410",84,626,1985,,1,,"['Fantasy', 'Fiction', 'Science Fiction Fantasy']"
241,https://www.goodreads.com//book/show/34040263-the-land,The Land: Raiders,Aleron Kong,4.45,"10,062",319,400,2017,,1,Goodreads Choice Award Nominee for Fantasy (2017),"['Fantasy', 'Fiction', 'Fantasy']"
242,https://www.goodreads.com//book/show/35231.Lord_of_Chaos,Lord of Chaos,Robert Jordan,4.13,"136,431","2,989",1011,1995,,1,"Locus Award Nominee for Best Fantasy Novel (1995), SFBC Award (1995)","['Fantasy', 'Fiction', 'Fantasy']"
243,https://www.goodreads.com//book/show/1046558.Shapechangers,Shapechangers,Jennifer Roberson,3.92,"3,824",139,224,1984,,1,,"['Fantasy', 'Fiction', 'Fantasy']"
244,https://www.goodreads.com//book/show/73906.Taliesin,Taliesin,Stephen R. Lawhead,3.99,"15,700",657,496,1998,,1,,"['Fantasy', 'Fiction', 'Mythology']"
245,https://www.goodreads.com//book/show/7139892-under-heaven,Under Heaven,Guy Gavriel Kay,4.15,"13,407","1,583",573,2010,China,1,"Locus Award Nominee for Best Fantasy Novel (2011), World Fantasy Award Nominee for Best Novel (2011), Mythopoeic Fantasy Award Nominee for Adult Literature (2011), Sunburst Award for Canadian Novel (2011), Prix Aurora Award Nominee for Best Novel (2011) and for Best of the Decade (2017) ...more","['Fantasy', 'Historical', 'Historical Fiction']"
246,https://www.goodreads.com//book/show/113435.Crossroads_of_Twilight,Crossroads of Twilight,Robert Jordan,3.81,"97,830","2,576",704,2003,,1,,"['Fantasy', 'Fiction', 'Fantasy']"
247,https://www.goodreads.com//book/show/126192.Mythago_Wood,Mythago Wood,Robert Holdstock,3.81,"8,717",746,336,2003,England,1,"World Fantasy Award for Best Novel (1985), British Science Fiction Association Award for Novel (1984)","['Fantasy', 'Fiction', 'Fantasy']"
248,https://www.goodreads.com//book/show/13993.Joust,Joust,Mercedes Lackey,4.03,"11,032",316,448,2004,,1,,"['Fantasy', 'Fantasy', 'Dragons']"
249,https://www.goodreads.com//book/show/13995.Winds_of_Fate,Winds of Fate,Mercedes Lackey,4.05,"16,002",259,460,1992,,1,,"['Fantasy', 'Fiction', 'Science Fiction Fantasy']"
250,https://www.goodreads.com//book/show/127584.Dragonquest,Dragonquest,Anne McCaffrey,4.06,"48,928",876,350,1986,Pern,1,"Hugo Award Nominee (1972), Locus Award Nominee for Best Novel (1972), Margaret A. Edwards Award (1999)","['Fantasy', 'Science Fiction', 'Fantasy']"
251,https://www.goodreads.com//book/show/208.A_Shadow_in_Summer,A Shadow in Summer,Daniel Abraham,3.61,"11,540",793,331,2006,,1,Locus Award Nominee for Best First Novel (2007),"['Fantasy', 'Fiction', 'Fantasy']"
252,https://www.goodreads.com//book/show/872109.Wit_ch_Fire,Wit'ch Fire,James Clemens,3.91,"6,474",334,448,1999,,1,,"['Fantasy', 'Fiction', 'Fantasy']"
253,https://www.goodreads.com//book/show/24249.A_Cavern_of_Black_Ice,A Cavern of Black Ice,J.V. Jones,3.87,"8,791",225,769,2005,,1,,"['Fantasy', 'Fantasy', 'Epic Fantasy']"
254,https://www.goodreads.com//book/show/11390271-origins,Origins,Angelo Tsanatelis,3.88,57,15,,2012,,1,,"['Fantasy', 'Fantasy', 'Dark Fantasy']"
255,https://www.goodreads.com//book/show/2890090-the-republic-of-thieves,The Republic of Thieves,Scott Lynch,4.20,"90,237","5,161",650,2013,,1,"Locus Award Nominee for Best Fantasy Novel (2014), David Gemmell Legend Award Nominee for Best Fantasy Novel (2014), David Gemmell Ravenheart Award Nominee for Best Fantasy Cover Art (2014), Goodreads Choice Award Nominee for Fantasy (2013)","['Fantasy', 'Fiction', 'Adventure']"
256,https://www.goodreads.com//book/show/34084.The_Waste_Lands,The Waste Lands,Stephen King,4.22,"194,907","5,953",422,2003,,1,,"['Fantasy', 'Fiction', 'Horror']"
257,https://www.goodreads.com//book/show/14744360-the-fish-the-fighters-and-the-song-girl,The Fish the Fighters and the Song-Girl,Janet E. Morris,4.66,145,17,297,2012,,1,,"['Fantasy', 'Heroic Fantasy', 'Sword and Sorcery']"
258,https://www.goodreads.com//book/show/140974.The_Path_of_Daggers,The Path of Daggers,Robert Jordan,3.91,"114,438","2,224",685,1999,,1,,"['Fantasy', 'Fiction', 'Fantasy']"
259,https://www.goodreads.com//book/show/127645.Sword_Dancer,Sword-Dancer,Jennifer Roberson,3.99,"7,650",223,286,1986,,1,,"['Fantasy', 'Fiction', 'Romance']"
260,https://www.goodreads.com//book/show/34234639-the-land,The Land: Founding,Aleron Kong,4.06,"22,709","1,429",252,2015,,1,,"['Fantasy', 'Fiction', 'Audiobook']"
261,https://www.goodreads.com//book/show/16096824-a-court-of-thorns-and-roses,A Court of Thorns and Roses,Sarah J. Maas,4.21,"592,907","54,981",419,2015,,1,"Lincoln Award Nominee (2017), Goodreads Choice Award Nominee for Young Adult Fantasy & Science Fiction (2015)","['Fantasy', 'Romance', 'Young Adult']"
262,https://www.goodreads.com//book/show/13891.Winter_s_Heart,Winter's Heart,Robert Jordan,3.94,"109,781","2,235",780,2002,,1,,"['Fantasy', 'Fiction', 'Fantasy']"
263,https://www.goodreads.com//book/show/28553.Dragondrums,Dragondrums,Anne McCaffrey,4.08,"32,839",634,243,2003,Pern,1,"Locus Award Nominee for Best SF Novel (1980), Ditmar Award Nominee for Best International Long Fiction (1980), Balrog Award for Best Novel (1980), Margaret A. Edwards Award (1999)","['Fantasy', 'Science Fiction', 'Fantasy']"
264,https://www.goodreads.com//book/show/28524.The_Soulforge,The Soulforge,Margaret Weis,4.16,"10,173",199,408,1999,,1,,"['Fantasy', 'Dungeons and Dragons', 'Dragonlance']"
265,https://www.goodreads.com//book/show/29227508-the-destroyer,The Destroyer,Michael-Scott Earle,4.02,"3,497",205,401,2016,,1,,"['Fantasy', 'Fiction', 'Adult']"
266,https://www.goodreads.com//book/show/249747.Artemis_Fowl,Artemis Fowl,Eoin Colfer,3.85,"516,748","12,210",396,2003,Dublin (Ireland),1,"Garden State Book Award for Fiction (Grades 6-8) (2004), Massachusetts Children's Book Award (2003), Blue Hen Book Award for Chapter Book (2003), Rhode Island Teen Book Award Nominee (2002), Pacific Northwest Library Association Young Reader's Choice Award for Intermediate (2004)","['Fantasy', 'Young Adult', 'Fiction']"
267,https://www.goodreads.com//book/show/10572.A_Clash_of_Kings,A Clash of Kings,George R.R. Martin,4.41,"813,167","24,343",969,2002,The Lands of Ice and Fire,1,"Nebula Award Nominee for Best Novel (1999), Locus Award for Best Fantasy Novel (1999), Premio Ignotus for Novela extranjera (2004)","['Fantasy', 'Fiction', 'Fantasy']"
268,https://www.goodreads.com//book/show/23437156-six-of-crows,Six of Crows,Leigh Bardugo,4.44,"399,489","48,551",465,2015,Ketterdam,1,"Pennsylvania Young Readers' Choice Award Nominee for Young Adults (2017), Rhode Island Teen Book Award Nominee (2018), Evergreen Teen Book Award Nominee (2018), Milwaukee County Teen Book Award Nominee (2017), Lincoln Award (2018) ...more","['Fantasy', 'Young Adult', 'Fiction']"
269,https://www.goodreads.com//book/show/76664.A_Spell_for_Chameleon,A Spell for Chameleon,Piers Anthony,3.90,"45,815","1,654",344,1977,,1,"Locus Award Nominee for Best Fantasy Novel (1978), Gandalf Award Nominee (1978), British Fantasy Award for Best Novel (August Derlith Fantasy Award) (1978)","['Fantasy', 'Fiction', 'Humor']"
270,https://www.goodreads.com//book/show/6736971-the-desert-spear,The Desert Spear,Peter V. Brett,4.19,"82,611","2,621",579,2010,,1,"Locus Award Nominee for Best Fantasy Novel (2011), David Gemmell Legend Award Nominee for Best Fantasy Novel (2011), Goodreads Choice Award Nominee for Fantasy (2010)","['Fantasy', 'Fantasy', 'Epic Fantasy']"
271,https://www.goodreads.com//book/show/28689.Stone_of_Farewell,Stone of Farewell,Tad Williams,4.06,"47,713",731,608,2005,,1,,"['Fantasy', 'Fiction', 'Fantasy']"
272,https://www.goodreads.com//book/show/252838.Lord_Valentine_s_Castle,Lord Valentine's Castle,Robert Silverberg,3.89,"8,788",353,506,1995,,1,"Hugo Award Nominee for Best Novel (1981), Locus Award for Best Fantasy Novel (1981), Balrog Award Nominee for Best Novel (1981)","['Fantasy', 'Science Fiction', 'Fiction']"
273,https://www.goodreads.com//book/show/92717.The_Darkangel,The Darkangel,Meredith Ann Pierce,3.90,"8,936",602,281,1998,,1,"IRA Children’s and Young Adult’s Book Award (1983), California Young Readers Medal for Young Adult (1986)","['Young Adult', 'Fantasy', 'Romance']"
274,https://www.goodreads.com//book/show/8253920-towers-of-midnight,Towers of Midnight,Robert Jordan,4.42,"131,293","3,096",863,2010,,1,"David Gemmell Legend Award Nominee for Best Fantasy Novel (2011), Goodreads Choice Award for Fantasy (2010)","['Fantasy', 'Fiction', 'Fantasy']"
275,https://www.goodreads.com//book/show/10194157-shadow-and-bone,Shadow and Bone,Leigh Bardugo,3.98,"403,902","43,348",358,2012,Ravka,1,"South Carolina Book Award Nominee for Junior Book (2015), Pennsylvania Young Readers' Choice Award Nominee for Young Adults (2014), Rhode Island Teen Book Award Nominee (2015), Dorothy Canfield Fisher Children's Book Award Nominee (2014), Lincoln Award Nominee (2014) ...more","['Fantasy', 'Young Adult', 'Romance']"
276,https://www.goodreads.com//book/show/13521459-red-country,Red Country,Joe Abercrombie,4.30,"36,759","2,103",469,2012,,1,"Locus Award Nominee for Best Fantasy Novel (2013), David Gemmell Legend Award Nominee for Best Fantasy Novel (2013), David Gemmell Ravenheart Award for Best Fantasy Cover Art (2013), Goodreads Choice Award Nominee for Fantasy (2012)","['Fantasy', 'Fiction', 'Westerns']"
277,https://www.goodreads.com//book/show/3314369-the-steel-remains,The Steel Remains,Richard K. Morgan,3.74,"15,048","1,244",391,2009,,1,Gaylactic Spectrum Award for Best Novel (2010),"['Fantasy', 'Fiction', 'LGBT']"
278,https://www.goodreads.com//book/show/262430.Gregor_the_Overlander,Gregor the Overlander,Suzanne Collins,3.99,"97,293","6,565",326,2005,"New York City, New York (United States)",1,"Texas Bluebonnet Award Nominee (2005), Pennsylvania Young Readers' Choice Award for Grades 6-8 (2006), Dorothy Canfield Fisher Children's Book Award Nominee (2005), Bluestem Book Award Nominee (2015), Rebecca Caudill Young Readers' Book Award Nominee (2007)","['Fantasy', 'Young Adult', 'Childrens']"
279,https://www.goodreads.com//book/show/25740412-the-black-witch,The Black Witch,Laurie Forest,4.08,"19,761","2,882",601,2017,,1,"Evergreen Teen Book Award Nominee for High School (2020), Goodreads Choice Award Nominee for Young Adult Fantasy & Science Fiction (2017)","['Fantasy', 'Young Adult', 'Paranormal']"
280,https://www.goodreads.com//book/show/6746405-fawcetta,Fawcetta,Dalian Artanian,4.14,86,32,320,2009,,1,,"['Fantasy', 'Young Adult']"
281,https://www.goodreads.com//book/show/13665333-inborn,Inborn,John LeViness,3.67,133,17,368,2012,,1,,"['Fantasy', 'Fantasy', 'Epic Fantasy']"
282,https://www.goodreads.com//book/show/25312178-the-stonegate-sword,The Stonegate Sword,Harry James Fox,4.26,100,48,458,2015,,1,,"['Fantasy', 'Christian Fiction', 'Christian Fantasy']"
283,https://www.goodreads.com//book/show/34234731-the-land,The Land: Catacombs,Aleron Kong,4.34,"10,370",280,391,2016,,1,,"['Fantasy', 'Fantasy', 'Magic']"
284,https://www.goodreads.com//book/show/28695.City_of_Golden_Shadow,City of Golden Shadow,Tad Williams,3.92,"25,885",907,780,1998,,1,Corine Internationaler Buchpreis for Futurepreis (2004),"['Fantasy', 'Science Fiction', 'Fiction']"
285,https://www.goodreads.com//book/show/951749.The_Dying_Earth,The Dying Earth,Jack Vance,3.92,"7,775",557,156,1977,,1,Retro Hugo Award Nominee for Best Novel (2001),"['Fantasy', 'Science Fiction', 'Fiction']"
286,https://www.goodreads.com//book/show/47989.Night_Watch,Night Watch,Terry Pratchett,4.47,"99,222","2,447",480,2011,Ankh-Morpork,1,"Locus Award Nominee for Best Fantasy Novel (2003), Prometheus Award for Best Novel (2003), Tähtifantasia Award Nominee (2011)","['Fantasy', 'Fiction', 'Humor']"
287,https://www.goodreads.com//book/show/185292.The_Ruins_of_Ambrai,The Ruins of Ambrai,Melanie Rawn,4.07,"8,932",187,928,1997,,1,,"['Fantasy', 'Fiction', 'Science Fiction Fantasy']"
288,https://www.goodreads.com//book/show/395962.Kushiel_s_Chosen,Kushiel's Chosen,Jacqueline Carey,4.24,"40,395","1,030",678,2003,,1,Locus Award Nominee for Best Fantasy Novel (2003),"['Fantasy', 'Romance', 'Fiction']"
289,https://www.goodreads.com//book/show/114936.The_Dragon_and_the_George,The Dragon and the George,Gordon R. Dickson,3.90,"6,056",215,286,,,1,"World Fantasy Award Nominee for Best Novel (1977), British Fantasy Award for Best Novel (1977)","['Fantasy', 'Fantasy', 'Dragons']"
290,https://www.goodreads.com//book/show/13888.Knife_of_Dreams,Knife of Dreams,Robert Jordan,4.14,"106,985","2,281",860,2006,,1,Locus Award Nominee for Best Fantasy Novel (2006),"['Fantasy', 'Fiction', 'Fantasy']"
291,https://www.goodreads.com//book/show/311864.Heroes_Die,Heroes Die,Matthew Woodring Stover,4.09,"11,123",637,545,1999,,1,,"['Fantasy', 'Science Fiction', 'Fiction']"
292,https://www.goodreads.com//book/show/40034669-the-octunnumi-fosbit-files-prologue,The Octunnumi Fosbit Files Prologue,Trevor Alan Foris,4.21,"9,398",167,520,2019,,0,,"['Fantasy', 'Fiction', 'Novels']"
293,https://www.goodreads.com//book/show/222837.Inda,Inda,Sherwood Smith,4.01,"4,364",378,576,2006,,1,,"['Fantasy', 'Fiction', 'Young Adult']"
294,https://www.goodreads.com//book/show/34484.Small_Gods,Small Gods,Terry Pratchett,4.30,"102,377","3,068",400,2005,Discworld,1,,"['Fantasy', 'Fiction', 'Humor']"
295,https://www.goodreads.com//book/show/43919.Faerie_Tale,Faerie Tale,Raymond E. Feist,3.88,"9,855",513,490,1989,United Kingdom,0,,"['Fantasy', 'Horror', 'Fiction']"
296,https://www.goodreads.com//book/show/13624.The_Worm_Ouroboros,The Worm Ouroboros,E.R. Eddison,3.70,"4,250",443,446,2006,Mercury,0,,"['Fantasy', 'Fiction', 'Classics']"
297,https://www.goodreads.com//book/show/22916.The_Complete_Fairy_Tales_of_The_Brothers_Grimm,The Complete Fairy Tales of The Brothers Grimm,Jacob Grimm,4.27,"149,951","2,610",762,2003,,0,"Zilveren Griffel (2006), Zilveren Penseel (2006)","['Classics', 'Fantasy', 'Fiction']"
298,https://www.goodreads.com//book/show/45101.The_Mad_Ship,The Mad Ship,Robin Hobb,4.20,"55,196","1,696",906,2008,,1,Endeavour Award Nominee (2000),"['Fantasy', 'Fiction', 'Fantasy']"
299,https://www.goodreads.com//book/show/64105.The_Last_Enchantment,The Last Enchantment,Mary Stewart,4.17,"14,561",429,513,2003,United Kingdom,1,Locus Award Nominee for Best Fantasy Novel (1980),"['Fantasy', 'Fiction', 'Historical']"
300,https://www.goodreads.com//book/show/28250.The_Novice,The Novice,Trudi Canavan,4.05,"55,536","1,431",577,2004,Kyralia,1,,"['Fantasy', 'Young Adult', 'Fantasy']"
301,https://www.goodreads.com//book/show/437786.Son_of_Avonar,Son of Avonar,Carol Berg,3.77,"3,046",114,471,2004,,1,,"['Fantasy', 'Fiction', 'Fantasy']"
302,https://www.goodreads.com//book/show/44688.Magician_s_Gambit,Magician's Gambit,David Eddings,4.12,"89,029",955,305,1983,,1,,"['Fantasy', 'Fiction', 'Young Adult']"
303,https://www.goodreads.com//book/show/45102.Ship_of_Destiny,Ship of Destiny,Robin Hobb,4.20,"62,260","1,860",789,2001,,1,,"['Fantasy', 'Fiction', 'Fantasy']"
304,https://www.goodreads.com//book/show/53450218-the-past,The Past,Kenneth Thomas,4.30,"6,550",235,195,2020,,1,,"['Science Fiction', 'Time Travel', 'Science Fiction']"
305,https://www.goodreads.com//book/show/43908.Shadow_of_a_Dark_Queen,Shadow of a Dark Queen,Raymond E. Feist,4.06,"27,141",279,497,1995,,1,,"['Fantasy', 'Fiction', 'Fantasy']"
306,https://www.goodreads.com//book/show/168525.The_Mabinogion_Tetralogy,The Mabinogion Tetralogy,Evangeline Walton,4.21,"1,078",79,720,2003,,1,,"['Fantasy', 'Fantasy', 'Mythology']"
